Sheet: Jan Actuals USD
D1: Net Serv $ (USD) | E1: Net Serv $ (CDN)
A2: Astra Oil Company LLC | B2: Astra Dynamics AMS | C2: ASTRA_AMS_001 | D2: 6388 | E2: =RC[-1]*R15C6 -> 7725.0595040000007
A3: Astra Oil Company LLC | B3: MS AX 2012 - HB Implemenation | C3: ASTRA_SIS_006 | E3: =RC[-1]*R15C6 -> 0
A4: Astra Oil Company LLC | B4: AX 2012 Implemt - Development | C4: ASTRA_SIS_007 | E4: =RC[-1]*R15C6 -> 0
A5: Astra Oil Company LLC | B5: Schd A5 - Actuals Interface | C5: ASTRA_SIS_009 | E5: =RC[-1]*R15C6 -> 0
A6: Transcor Astra Group SA | B6: Dynamics AX Users - Calgary | C6: TRANSCO_SIS_005 | E6: =RC[-1]*R15C6 -> 0
A7: Transcor Astra Group SA | B7: Microsoft Dynamics Annual Ren. | C7: TRANSCO_SIS_006 | E7: =RC[-1]*R15C6 -> 0
D9: =SUM(R[-7]C:R[-1]C) -> 6388 | E9: =SUM(R[-7]C:R[-1]C) -> 7725.0595040000007
A13: @ Jan 31/2015
A14: From Cur | B14: To Cur | C14: Rate Type | D14: Eff Date | E14: Status | F14: Exch Rate
A15: USD | B15: CAD | C15: AVG | D15: 2015-01-31T00:00:00.000 | E15: A | F15: 1.209308
A16: USD | B16: CAD | C16: CRRNT | D16: 2015-01-31T00:00:00.000 | E16: A | F16: 1.2732000000000001
A19: @ Jan 31/2015
A20: From Cur | B20: To Cur | C20: Rate Type | D20: Eff Date | E20: Status | F20: Exch Rate
A21: CAD | B21: USD | C21: AVG | D21: 2015-01-31T00:00:00.000 | E21: A | F21: 0.82691919000000003
A22: CAD | B22: USD | C22: CRRNT | D22: 2015-01-31T00:00:00.000 | E22: A | F22: 0.78542255000000005

Sheet: Jan Actuals
A1: Client | B1: Project | C1: Project Code | D1: NET Services | E1: OTHER Rev
A2: 630 CHED Santas Anonymous | B2: CR2014 Mobile App Enhancements | C2: SANTA_AMS_001 | D2: 0 | E2: 0
A3: Aeroinfo Systems a Div of Boeing Canada | B3: eMANUAL IMPLEMENTATION | C3: AEROINF_SIS_004 | D3: 0 | E3: 0
A4: Aeroinfo Systems a Div of Boeing Canada | B4: AeroInfo eManual enhancements | C4: AEROINF_SIS_005 | D4: 12797.5 | E4: 0
A5: Ainsworth Engineered | B5: Microsoft Dynamics AX Fit Gap | C5: AINSWOR_SIS_001 | D5: 27793.27 | E5: 0
A6: Alberta Culture and Tourism | B6: 2014_21 Sharepoint Migration | C6: ABCULTO_AMS_001 | D6: 1880 | E6: 0
A7: Alberta Culture and Tourism | B7: 2014_25 Public Website Dev | C7: ABCULTO_AMS_002 | D7: 8107.5 | E7: 0
A8: Alberta Culture and Tourism | B8: 2014_26 Sharepoint Intranet Re | C8: ABCULTO_AMS_003 | D8: 7930 | E8: 0
A9: Alberta Culture and Tourism | B9: TPR RAP AMS Support 2013 - 15 | C9: ABTRPKR_AMS_017 | D9: 43333.33 | E9: 0
A10: Alberta Culture and Tourism | B10: Reservation Revenue Fee | C10: ABTRPKR_AMS_033 | D10: 0 | E10: 0
A11: Alberta Culture and Tourism | B11: CR 41 Ph 1 RAP Tec Upgrade | C11: ABTRPKR_AMS_053 | D11: 11038 | E11: 0
A12: Alberta Culture and Tourism | B12: WO_2013_51 Culture App Upgrade | C12: ABTRPKR_AMS_059 | D12: 0 | E12: 0
A13: Alberta Culture and Tourism | B13: WO_2014_02 App Mgmt Transition | C13: ABTRPKR_AMS_063 | D13: 0 | E13: 0
A14: Alberta Culture and Tourism | B14: WO_2014_01 Serv. Delivery Mgmt | C14: ABTRPKR_AMS_064 | D14: 1048.3900000000001 | E14: 0
A15: Alberta Culture and Tourism | B15: WO_2014_03 App Support Culture | C15: ABTRPKR_AMS_065 | D15: 20172.5 | E15: 0
A16: Alberta Culture and Tourism | B16: WO_2014_04 GATE Programme Mgr | C16: ABTRPKR_AMS_066 | D16: 1283.9399999999996 | E16: 0
A17: Alberta Culture and Tourism | B17: WO_2014_07 GATA AFA Implementa | C17: ABTRPKR_AMS_068 | D17: 23430 | E17: 0
A18: Alberta Culture and Tourism | B18: WO_2014_08 Programme Developme | C18: ABTRPKR_AMS_069 | D18: 0 | E18: 0
A19: Alberta Culture and Tourism | B19: WO_2014_09 PM Services | C19: ABTRPKR_AMS_072 | D19: 16687.5 | E19: 0
A20: Alberta Culture and Tourism | B20: WO_2014_17 AFA Support | C20: ABTRPKR_AMS_073 | D20: 7207.5 | E20: 0
A21: Alberta Culture and Tourism | B21: CR43-TIPs Integration for Reg. | C21: ABTRPKR_AMS_074 | D21: 0 | E21: 0
A22: Alberta Culture and Tourism | B22: RAP CR45-Addition of New Camp. | C22: ABTRPKR_AMS_076 | D22: 2017 | E22: 0
A23: Alberta Culture and Tourism | B23: WO_2014_23 Customer Intelligen | C23: ABTRPKR_AMS_077 | D23: 0 | E23: 0
A24: Alberta Culture and Tourism | B24: RAP - Performance Testing Exe | C24: ABTRPKR_AMS_078 | D24: 27782 | E24: 29300
A25: Alberta Culture and Tourism | B25: WO_2014_12 TMS Migration | C25: ABTRPKR_AMS_079 | D25: 0 | E25: 0
A26: Alberta Culture and Tourism | B26: WO_2014_24 SW Modernization | C26: ABTRPKR_AMS_080 | D26: 17607.5 | E26: 0
A27: Alberta Culture and Tourism | B27: RAP V3 Modernization Project | C27: ABTRPKR_SIS_019 | D27: 0 | E27: 0
A28: Alberta Health Services | B28: AHS CD/OM PROJECT | C28: ALBHSVC_SIS_018 | D28: 468683.83 | E28: 0
A29: Alberta Health Services | B29: eCritical Alberta Project | C29: ALBHSVC_SIS_033 | D29: 27667.5 | E29: 0
A30: Alberta Health Services | B30: ICC/pHIE Integration Coordinat | C30: ALBHSVC_SIS_037 | D30: 0 | E30: 0
A31: Alberta Health Services | B31: Change Management Expert | C31: ALBHSVC_SIS_038 | D31: 26541.72 | E31: 0
A32: Alberta Health Services | B32: eCritical Project Senior Test | C32: ALBHSVC_SIS_039 | D32: 21971.25 | E32: 0
A33: Alberta Health Services | B33: Meditech Optimization | C33: ALBHSVC_SIS_040 | D33: 76562.25 | E33: 0
A34: Alberta Health Services | B34: Meditech Optimization_ CClarke | C34: ALBHSVC_SIS_041 | D34: 24154.66 | E34: 0
A35: Alberta Justice & Solicitor General | B35: CCM 2014/15 Criminal e-File | C35: ABJUSTI_SIS_003 | D35: 118395.38 | E35: 0
A36: Alberta Municipal Affairs | B36: HAL Business Architect | C36: ABMUNI_SIS_001 | D36: 15437.5 | E36: 0
A37: Alberta Social Housing Corporation | B37: Senior PLSQL Analyst | C37: ASHC_SIS_001 | D37: 15930 | E37: 0
A38: Alberta Solicitor General | B38: TRAVEL TIME & EXPENSE - NON RE | C38: ABSOLIC_SIS_006 | D38: -3555.7000000000003 | E38: 0
A39: Alberta Solicitor General | B39: SOW009 - ONGOING SUPPORT (FP) | C39: ABSOLIC_SIS_009 | D39: 65491.57 | E39: 0
A40: Alberta Solicitor General | B40: API3 RISK/REWARD TRACKING | C40: ABSOLIC_SIS_010 | D40: 0 | E40: 0
A41: Alpac Forest Products Inc | B41: Dynamics AX Support and CR | C41: ALPACFP_AMS_005 | D41: 16000 | E41: 0
A42: Altalink Management Ltd | B42: CLIENT TIME - PROJECT | C42: ALTALIN_AMS_002 | D42: 72096 | E42: 0
A43: Altalink Management Ltd | B43: AMS Fixed Price Template | C43: ALTALIN_AMS_005 | D43: 52452.88 | E43: 0
A44: Altalink Management Ltd | B44: FF ScoreCard Project | C44: ALTALIN_AMS_006 | D44: 300 | E44: 0
A45: Altalink Management Ltd | B45: Asset Management Teamsite | C45: ALTALIN_SIS_005 | D45: 0 | E45: 0
A46: Altalink Management Ltd | B46: GI Projects | C46: ALTALIN_SIS_007 | D46: -1942.5 | E46: 0
A47: Annex Consulting Group Inc. | B47: WorkSafe Peoplesoft Consulting | C47: ANNEX_SIS_001 | D47: 13893.6 | E47: 0
A48: Astra Energy Canada Inc. | B48: Dynamics Maintenance Renewal | C48: ASTRA_SIS_011 | D48: 0 | E48: 24543.99
A49: BC Automobile Association | B49: BCAA -dev Mary Cheung | C49: BCAA_SIS_013 | D49: 9890 | E49: 0
A50: BC Automobile Association | B50: Java Development | C50: BCAA_SIS_014 | D50: 0 | E50: 0
A51: BC Ministry of Children and Family Dev | B51: TA for Integrd Case Mgmt (ICM) | C51: BCMCFD_SIS_001 | D51: 24480 | E51: 0
A52: BC Ministry of Justice | B52: Courts Maintenance (12/13) | C52: BCJUSTI_AMS_001 | D52: 0 | E52: 0
A53: BC Ministry of Justice | B53: CSB Maintenance (13/14) | C53: BCJUSTI_AMS_010 | D53: 0 | E53: 0
A54: BC Ministry of Justice | B54: JUSTIN Maintenance FY14-15 | C54: BCJUSTI_AMS_016 | D54: 10002.800000000001 | E54: 0
A55: BC Ministry of Justice | B55: Security Progr. Supp. FY14/15 | C55: BCJUSTI_AMS_017 | D55: 23752.3 | E55: 0
A56: BC Ministry of Justice | B56: CSB System Maint. FY14-15(N) | C56: BCJUSTI_AMS_018 | D56: 84984.55 | E56: 0
A57: BC Ministry of Justice | B57: Corrections Supp.& MaintF14/15 | C57: BCJUSTI_AMS_019 | D57: 34257.449999999997 | E57: 0
A58: BC Ministry of Justice | B58: RoadSafetyBC Maint. FY14-15 | C58: BCJUSTI_AMS_020 | D58: 16101.41 | E58: 0
A59: BC Ministry of Justice | B59: CJB BI Maintenance FY14-15 | C59: BCJUSTI_AMS_021 | D59: 4725.6000000000004 | E59: 0
A60: BC Ministry of Justice | B60: LRA BC Maintenance FY14-15 | C60: BCJUSTI_AMS_022 | D60: 10346.200000000001 | E60: 0
A61: BC Ministry of Justice | B61: Tosca Maintenance FY14-15 | C61: BCJUSTI_AMS_023 | D61: 444 | E61: 0
A62: BC Ministry of Justice | B62: Corp. BI Person Layer Sub.Area | C62: BCJUSTI_SIS_018 | D62: 0 | E62: 0
A63: BC Ministry of Justice | B63: Justice Information Architectu | C63: BCJUSTI_SIS_027 | D63: 0 | E63: 0
A64: BC Ministry of Justice | B64: JUSTIN BettermentsFY14/15(N) | C64: BCJUSTI_SIS_036 | D64: 11573.300000000001 | E64: 0
A65: BC Ministry of Justice | B65: ICON II Pilot & Dep. FY14/15 | C65: BCJUSTI_SIS_037 | D65: 44942.400000000001 | E65: 0
A66: BC Ministry of Justice | B66: ISB VAMP App.Testing&Supp(N) | C66: BCJUSTI_SIS_038 | D66: 1971.2 | E66: 0
A67: BC Ministry of Justice | B67: CCD - Prod.Pilot Launch | C67: BCJUSTI_SIS_039 | D67: 0 | E67: 0
A68: BC Ministry of Justice | B68: PCSS Project FY14/15(N) | C68: BCJUSTI_SIS_040 | D68: 0 | E68: 0
A69: BC Ministry of Justice | B69: Criminal Data -CaseDetails (N) | C69: BCJUSTI_SIS_041 | D69: 20893 | E69: 0
A70: BC Ministry of Justice | B70: (EMBC) Prov.Emerg.Sys PENS(N) | C70: BCJUSTI_SIS_042 | D70: 1923.2 | E70: 0
A71: BC Ministry of Justice | B71: Victim Services&Crime Prev(N) | C71: BCJUSTI_SIS_043 | D71: 0 | E71: 0
A72: BC Ministry of Justice | B72: CATS - Suite (N) | C72: BCJUSTI_SIS_045 | D72: 145470.85 | E72: 0
A73: BC Ministry of Justice | B73: PAC - Health Assessment (N) | C73: BCJUSTI_SIS_046 | D73: 1225.2 | E73: 0
A74: BC Ministry of Justice | B74: TTI - PM support (N) | C74: BCJUSTI_SIS_047 | D74: 24602.400000000001 | E74: 0
A75: BC Ministry of Justice | B75: Planning Division Res. Sup (N) | C75: BCJUSTI_SIS_048 | D75: 36035.800000000003 | E75: 0
A76: BC Ministry of Justice | B76: JUSTIN audit (N) | C76: BCJUSTI_SIS_049 | D76: 0 | E76: 0
A77: BC Ministry of Justice | B77: R&D Fund F14/15 | C77: BCJUSTI_SIS_050 | D77: 37396.770000000004 | E77: 0
A78: BC Ministry of Justice | B78: Service Exp.Eval & Design(N) | C78: BCJUSTI_SIS_051 | D78: 0 | E78: 0
A79: BC Ministry of Justice | B79: Justice Sys.ActorsCorpBIPh2(N) | C79: BCJUSTI_SIS_052 | D79: 17789.400000000001 | E79: 0
A80: BC Ministry of Justice | B80: Cognos 10.2.2 Upgrade | C80: BCJUSTI_SIS_053 | D80: 41105.85 | E80: 0
A81: BC Ministry of Justice | B81: MITACS - SFU Data Extracts | C81: BCJUSTI_SIS_054 | D81: 0 | E81: 0
A82: BC Ministry of Justice | B82: BI Capital Asses Reporting | C82: BCJUSTI_SIS_055 | D82: 4894.2 | E82: 0
A83: BC Ministry of Justice | B83: (EMBC) - NAAD | C83: BCJUSTI_SIS_056 | D83: 4599.2 | E83: 0
A84: BC Ministry of Justice | B84: Victim Services STV | C84: BCJUSTI_SIS_057 | D84: 961.6 | E84: 0
A85: BC Ministry of Justice | B85: Quartech RF&AF for PS | C85: BCJUSTI_SIS_058 | D85: 0 | E85: 0
A86: BC Ministry of Tech, Innov, & Citz Serv | B86: IDIM CORPORATE INFRASTRUCTURE | C86: BCCITIZ_SIS_008 | D86: 195538.55 | E86: 0
A87: BC Ministry of Tech, Innov, & Citz Serv | B87: Corp App Qual Asrn & Test | C87: BCCITIZ_SIS_087 | D87: 16200 | E87: 0
A88: BC Ministry of Tech, Innov, & Citz Serv | B88: Fix-It Phase 2 | C88: BCCITIZ_SIS_134 | D88: 0 | E88: 0
A89: BC Ministry of Tech, Innov, & Citz Serv | B89: Address Chg Bus & Citiz App. | C89: BCMTICS_SIS_014 | D89: 787.5 | E89: 0
A90: BC Ministry of Tech, Innov, & Citz Serv | B90: Java Developer | C90: BCMTICS_SIS_015 | D90: 5353 | E90: 0
A91: BC Ministry of Tech, Innov, & Citz Serv | B91: Network Tools BA | C91: BCMTICS_SIS_027 | D91: 33312.5 | E91: 0
A92: BC Ministry of Tech, Innov, & Citz Serv | B92: Refreshed EA RoadMap | C92: BCMTICS_SIS_031 | D92: 0 | E92: 0
A93: BC Ministry of Tech, Innov, & Citz Serv | B93: CMF 1.5 Testing and Implementa | C93: BCMTICS_SIS_035 | D93: 0 | E93: 0
A94: BC Ministry of Tech, Innov, & Citz Serv | B94: AVED-Underst.Student Journey | C94: BCMTICS_SIS_040 | D94: 0 | E94: 0
A95: BC Ministry of Tech, Innov, & Citz Serv | B95: Service Mgmt:Tools & Processes | C95: BCMTICS_SIS_046 | D95: 72589.56 | E95: 0
A96: BC Ministry of Tech, Innov, & Citz Serv | B96: MCFD Stage 2: Intranet Nav. | C96: BCMTICS_SIS_050 | D96: 0 | E96: 0
A97: BC Ministry of Tech, Innov, & Citz Serv | B97: IDIM Program-BCeI & Biometrics | C97: BCMTICS_SIS_053 | D97: 31341 | E97: 0
A98: BC Ministry of Tech, Innov, & Citz Serv | B98: Childcare & Early Years Strat. | C98: BCMTICS_SIS_054 | D98: 22180 | E98: 0
A99: BC Ministry of Tech, Innov, & Citz Serv | B99: PayBC - CO-296 | C99: BCMTICS_SIS_055 | D99: 0 | E99: 0
A100: BC Ministry of Tech, Innov, & Citz Serv | B100: CCMF Enhancements Q3-4 CO-298 | C100: BCMTICS_SIS_057 | D100: 6555 | E100: 0
A101: BC Ministry of Tech, Innov, & Citz Serv | B101: e-Newsletter Release 3.3 | C101: BCMTICS_SIS_058 | D101: 1050 | E101: 0
A102: BC Ministry of Tech, Innov, & Citz Serv | B102: CCMF Enhancements Q3 | C102: BCMTICS_SIS_059 | D102: 15093.75 | E102: 0
A103: BC Ministry of Tech, Innov, & Citz Serv | B103: CCMF Q3-Q4 - CO-303 | C103: BCMTICS_SIS_060 | D103: 17825 | E103: 0
A104: BC Ministry of Tech, Innov, & Citz Serv | B104: Commercialization and API | C104: BCMTICS_SIS_061 | D104: 16280 | E104: 0
A105: BC Ministry of Tech, Innov, & Citz Serv | B105: MTICS Content Dev. CO-304 | C105: BCMTICS_SIS_062 | D105: 16770 | E105: 0
A106: BC Ministry of Tech, Innov, & Citz Serv | B106: CCMF Q3-4 FY14-15 - CO306 | C106: BCMTICS_SIS_063 | D106: 18112.5 | E106: 0
A107: BC Ministry of Tech, Innov, & Citz Serv | B107: BC Dev. Exch.Framework -CO307 | C107: BCMTICS_SIS_064 | D107: 1667.5 | E107: 0
A108: BC Ministry of Tech, Innov, & Citz Serv | B108: BC Dev. Exchange Fwk - CO-309 | C108: BCMTICS_SIS_065 | D108: -4827.5 | E108: 0
A109: BC Ministry of Tech, Innov, & Citz Serv | B109: BC Stats, Reg. & BC Online Res | C109: BCMTICS_SIS_066 | D109: 5600 | E109: 0
A110: BC Ministry of Tech, Innov, & Citz Serv | B110: Service BC Design Research | C110: BCMTICS_SIS_067 | D110: 6672 | E110: 0
A111: BC Ministry of Tech, Innov, & Citz Serv | B111: BC Dev. Exch.Framework CO-315 | C111: BCMTICS_SIS_068 | D111: 51240 | E111: 0
A112: BC Ministry of Tech, Innov, & Citz Serv | B112: Java Dev Serv.Onestop,CorpOL | C112: BCMTICS_SIS_069 | D112: 32228.25 | E112: 0
A113: BC Ministry of Tech, Innov, & Citz Serv | B113: CCMF Enhanc.Q3-4 CO-316 | C113: BCMTICS_SIS_071 | D113: 6120 | E113: 0
A114: BC Ministry Transport & Infrastructure | B114: Consulting Services | C114: BCMTRAN_SIS_001 | D114: 7600 | E114: 0
A115: Bell Lumber & Pole | B115: AX implementation -phase 1 | C115: BLPOLE_SIS_003 | D115: 34770 | E115: 0
A116: Bell Lumber & Pole | B116: Maintenance Renewal | C116: BLPOLE_SIS_004 | D116: 0 | E116: 9835.7900000000009
A117: British Columbia Assessment | B117: Corp. PMO Startup Phase PM Srv | C117: BCASM_SIS_007 | D117: 0 | E117: 0
A118: British Columbia Assessment | B118: CPMO Services | C118: BCASM_SIS_008 | D118: 0 | E118: 0
A119: British Columbia Assessment | B119: CMPO Services | C119: BCASM_SIS_009 | D119: 19687.5 | E119: 0
A120: British Columbia Ferry Services Inc | B120: Oracle Payroll Project | C120: BCFERRY_SIS_004 | D120: -69.55 | E120: 0
A121: British Columbia Ferry Services Inc | B121: Best Practice and Methods | C121: BCFERRY_SIS_006 | D121: 14650 | E121: 0
A122: British Columbia Ferry Services Inc | B122: Project Managment ACE (BTC) Pr | C122: BCFERRY_SIS_007 | D122: 20687.5 | E122: 0
A123: British Columbia Ferry Services Inc | B123: Technical Manager | C123: BCFERRY_SIS_008 | D123: 17250 | E123: 0
A124: British Columbia Ferry Services Inc | B124: BA ACE PROGRAM | C124: BCFERRY_SIS_010 | D124: 16800 | E124: 0
A125: British Columbia Ferry Services Inc | B125: BA ACE Program | C125: BCFERRY_SIS_011 | D125: 12915 | E125: 0
A126: British Columbia Ferry Services Inc | B126: ACE Team for BTC stream | C126: BCFERRY_SIS_012 | D126: 13125 | E126: 0
A127: British Columbia Hydro | B127: Web Portal Roadmap | C127: BCHYDRO_SIS_001 | D127: 720 | E127: 0
A128: British Columbia Liquor Distribution Bra | B128: Change Mgmt PM Retail Sys Upgr | C128: BCLDB_MCS_001 | D128: 20720 | E128: 0
A129: British Columbia Liquor Distribution Bra | B129: RAPP Data Warehouse Developer | C129: BCLDB_SIS_001 | D129: 13708.58 | E129: 0
A130: British Columbia Liquor Distribution Bra | B130: PeopleSoft Tax 15 | C130: BCLDB_SIS_002 | D130: 990 | E130: 0
A131: British Columbia Ministry of Health | B131: BC Services Card Project | C131: BCHEALT_SIS_001 | D131: 54127.23 | E131: 0
A132: British Columbia Oil and Gas Commission | B132: BI Foundation Assessment | C132: BCOGC_SIS_001 | D132: 0 | E132: 0
A133: British Columbia Oil and Gas Commission | B133: Business Transition Strategy | C133: BCOGC_SIS_002 | D133: 17812.5 | E133: 0
A134: British Columbia Oil and Gas Commission | B134: Business Transition Requiremen | C134: BCOGC_SIS_003 | D134: 15237.5 | E134: 0
A135: British Columbia Pension Corp | B135: RMS App Dev and Supp | C135: BCPENSI_SIS_007 | D135: 52487.5 | E135: 0
A136: Calgary Airport Authority | B136: IT Intergration | C136: CAA_SIS_002 | D136: 66281.25 | E136: 0
A137: Calgary Airport Authority | B137: Terminal Intgr and Resigning | C137: CAA_SIS_004 | D137: 0 | E137: 0
A138: Calgary Airport Authority | B138: Data & Software Architect | C138: CAA_SIS_005 | D138: 21140 | E138: 0
A139: Calgary Airport Authority | B139: Sr. Business Analyst - Wong | C139: CAA_SIS_006 | D139: 18324 | E139: 0
A140: Calgary Airport Authority | B140: Buisness Analyst - K. Yasinko | C140: CAA_SIS_007 | D140: 10520 | E140: 0
A141: Calgary Airport Authority | B141: PM - Shahzad Qureshi | C141: CAA_SIS_008 | D141: 25485 | E141: 0
A142: Calgary Airport Authority | B142: ITIL Foundations V3 Training - | C142: CAA_TRAIN | D142: 0 | E142: 0
A143: Calgary Immigrant Womens Assoc | B143: CMS Enhancement Project | C143: CGYIMM_SIS_007 | D143: -450 | E143: 0
A144: Canadian Pacific Railway | B144: Mainframe Rehosting | C144: CPR_AMS_003 | D144: 20245 | E144: 0
A145: Canadian Pacific Railway | B145: SKILLS | C145: CPR_SIS_001 | D145: 23780 | E145: 25000
A146: Canadian Western Bank | B146: SOW 004 - CMDB Design | C146: CWBANK_AMS_004 | D146: 0 | E146: 0
A147: Canadian Western Bank | B147: AMS Manager | C147: CWBANK_AMS_005 | D147: 15640 | E147: 0
A148: Canadian Western Bank | B148: ARIS Process Modelling | C148: CWBANK_MCS_001 | D148: 14650 | E148: 0
A149: Canadian Western Trust | B149: Procurement Project | C149: CWT_MCS_002 | D149: 6860 | E149: 0
A150: Canadian Western Trust | B150: Project PM | C150: CWT_SIS_001 | D150: 7200 | E150: 0
A151: CEDA International Corporation | B151: PACE Program | C151: CEDA_MCS_004 | D151: 29460 | E151: 0
A152: Cenovus Energy Inc | B152: TALENT MANAGEMENT PROJECT ARCH | C152: CENOVUS_SIS_003 | D152: 0 | E152: 0
A153: Cenovus Energy Inc | B153: GIS BUSINESS ANALYST | C153: CENOVUS_SIS_004 | D153: 14220 | E153: 0
A154: Christmas Bureau of Edmonton | B154: Change Requests 2014 | C154: CBE_AMS_001 | D154: 0 | E154: 0
A155: City of Calgary | B155: CIAO/BA DEVELOPER | C155: CITYCGY_SIS_005 | D155: 12757.5 | E155: 0
A156: City of Calgary | B156: Technical Analyst - PS HCM 9.1 | C156: CITYCGY_SIS_012 | D156: 0 | E156: 0
A157: City of Calgary | B157: PS - HCM Tech Analyst | C157: CITYCGY_SIS_014 | D157: 17250 | E157: 0
A158: City of Edmonton | B158: PETS Suport - Core Hours | C158: CITYEDM_AMS_008 | D158: 452.5 | E158: 0
A159: City of Edmonton | B159: MMSX 2.0 AMS 2014 - 2015 | C159: CITYEDM_AMS_011 | D159: 21250 | E159: 0
A160: City of Edmonton | B160: FINES Replacement Project | C160: CITYEDM_SIS_003 | D160: 53323 | E160: 0
A161: College of Physicians and Surgeons BC | B161: Implementation Membership Mgmt | C161: BCPHYS_SIS_001 | D161: 0 | E161: 0
A162: College of Physicians and Surgeons BC | B162: Casper | C162: BCPHYS_SIS_003 | D162: 52560 | E162: 0
A163: College Registered Nurses British Colum | B163: Competency Assessment Project | C163: CRNBC_MCS_001 | D163: 63976.54 | E163: 0
A164: Connacher Oil and Gas Limited | B164: Monthly AMS Support | C164: CONNOIL_AMS_002 | D164: 455 | E164: 0
A165: Diagnostic Services of Manitoba | B165: Digital Pathology-Proj Manager | C165: DIAGSRV_SIS_002 | D165: 23993.27 | E165: 0
A166: Diagnostic Services of Manitoba | B166: BA _Digital Pathology Project | C166: DIAGSRV_SIS_003 | D166: 14795 | E166: 0
A167: Diagnostic Services of Manitoba | B167: Privacy analyst for Digital Pa | C167: DIAGSRV_SIS_004 | D167: 4387.5 | E167: 0
A168: Diagnostic Services of Manitoba | B168: Risk Assessment Analyst | C168: DIAGSRV_SIS_005 | D168: 9450 | E168: 0
A169: E-COMM Emergency Comm for SW BC Inc. | B169: E-Comm NGRP Procurement | C169: ECOMM_MCS_001 | D169: 0 | E169: 0
A170: eHealth Saskatchewan | B170: PRSC MAINTENANCE & SUPPORT | C170: EHLSASK_SIS_003 | D170: 39565.660000000003 | E170: 0
A171: eHealth Saskatchewan | B171: PM & PRS Technical Consulting | C171: EHLSASK_SIS_015 | D171: 0 | E171: 0
A172: Encana Services Company Ltd. | B172: STAFF AUGMENTATION - H. ARIZAL | C172: ENCANAS_AMS_002 | D172: 8481 | E172: 0
A173: Encana Services Company Ltd. | B173: ENCANA LIVELINK - T&M PORTION | C173: ENCANAS_AMS_006 | D173: 52449.25 | E173: 0
A174: Encana Services Company Ltd. | B174: STAFF AUGMENTATION - HAO XU | C174: ENCANAS_SIS_001 | D174: 0 | E174: 0
A175: Ensign Energy Services | B175: Business Analyst | C175: ENSIGN_SIS_002 | D175: 15000 | E175: 0
A176: Ensign Energy Services | B176: SIS T&M Template | C176: ENSIGN_SIS_006 | D176: 21000 | E176: 0
A177: Goldcorp Inc | B177: Goldcorp - 7X24 SERVICE | C177: GOLDCRP_SIS_064 | D177: 2480 | E177: 0
A178: Goldcorp Inc | B178: Goldcorp - RSA VPN TOKEN PROJ | C178: GOLDCRP_SIS_065 | D178: 0 | E178: 0
A179: Goldcorp Inc | B179: PROJECT ADMINISTRATION | C179: GOLDCRP_SIS_075 | D179: 0 | E179: 0
A180: Goldcorp Inc | B180: IT Enterprise Technology Serv. | C180: GOLDCRP_SIS_135 | D180: 390090 | E180: 0
A181: Goldcorp Inc | B181: Slope Stability Radar Remediat | C181: GOLDCRP_SIS_136 | D181: 65 | E181: 0
A182: Government of Saskatchewan | B182: ITO-10933-005 Abilash M. | C182: SKGOVT_SIS_003 | D182: 11942.5 | E182: 0
A183: Great-West Life Assurance Co | B183: Sr PM - 2012 CLASS Foundation | C183: GWL_SIS_002 | D183: 19687.5 | E183: 0
A184: Great-West Life Assurance Co | B184: Client Communications Project | C184: GWL_SIS_003 | D184: 18112.5 | E184: 0
A185: Great-West Life Assurance Co | B185: Sr. PM - SES Projects | C185: GWL_SIS_004 | D185: 17464 | E185: 0
A186: Great-West Life Assurance Co | B186: Application Hosting Services - | C186: GWL_SIS_005 | D186: 0 | E186: 0
A187: Great-West Life Assurance Co | B187: PM with ADIS Domain - Skladnik | C187: GWL_SIS_006 | D187: 17656.25 | E187: 0
A188: Harmac Pacific | B188: Harmac AX Support 2013 | C188: HARMAC_AMS_001 | D188: 2834.54 | E188: 0
A189: Harmac Pacific | B189: Fiber systems Upgrade | C189: HARMAC_SIS_008 | D189: 0 | E189: 0
A190: HP ADVANCED SOLUTIONS INC | B190: HPAS AMS | C190: HPADVA_AMS_001 | D190: 0 | E190: 0
A191: HP ADVANCED SOLUTIONS INC | B191: HPAS SI | C191: HPADVA_SIS_001 | D191: 101521.5 | E191: 0
A192: HP ADVANCED SOLUTIONS INC | B192: Cloud Services Project | C192: HPADVA_SIS_003 | D192: 0 | E192: 0
A193: HP Co Canada | B193: TEAM EFS - AOS/AMS | C193: HEWLETT_AMS_002 | D193: 35592.369999999995 | E193: 0
A194: HP Co Canada | B194: AMS - Cenovus | C194: HEWLETT_AMS_006 | D194: 190852.23 | E194: 0
A195: HP Co Canada | B195: TEAM EFS - ADS | C195: HEWLETT_SIS_001 | D195: 61584.79 | E195: 0
A196: HP Co Canada | B196: ADS - Cenovus | C196: HEWLETT_SIS_003 | D196: 102769.27 | E196: 0
A197: Insurance Corp of British Columbia(ICBC) | B197: HP trim to Opentext | C197: ICBC_AMS_001 | D197: 0 | E197: 0
A198: Insurance Corp of British Columbia(ICBC) | B198: ICBC Drivers licensing roadmap | C198: ICBC_SIS_002 | D198: 0 | E198: 0
A199: Interfor | B199: Dynamics AX Support | C199: INTRFOR_AMS_001 | D199: 11659.5 | E199: 0
A200: Interfor | B200: INTERFOR ATLAS MAINT RENEWAL | C200: INTRFOR_SIS_006 | D200: 0 | E200: 0
A201: Interfor | B201: AX Training | C201: INTRFOR_SIS_007 | D201: 0 | E201: 0
A202: International Technology Integration Inc | B202: LRA Maintenance MB FY14-15 | C202: INTTECH_AMS_003 | D202: 4004 | E202: 0
A203: Investors Group | B203: SENIOR ANALYST - AL MOXAM | C203: INVESTO_SIS_006 | D203: 0 | E203: 0
A204: Investors Group | B204: ANALYST - JON ADAMOWICZ | C204: INVESTO_SIS_010 | D204: 17280 | E204: 0
A205: Investors Group | B205: ETL - DARREN WITTMANN | C205: INVESTO_SIS_011 | D205: 16800 | E205: 0
A206: Investors Group | B206: QA - Cliff Watson | C206: INVESTO_SIS_013 | D206: 13860 | E206: 0
A207: Investors Group | B207: ARCHITECT - Waiyen Chu | C207: INVESTO_SIS_014 | D207: 0 | E207: 0
A208: Investors Group | B208: System Integrator Support | C208: INVESTO_SIS_019 | D208: 17167.5 | E208: 0
A209: Investors Group | B209: Fusion Project - Bibiane Comte | C209: INVESTO_SIS_021 | D209: 54340 | E209: 0
A210: Investors Group | B210: Fusion Project - Lora Pickard | C210: INVESTO_SIS_023 | D210: 0 | E210: 0
A211: Investors Group | B211: Fusion SAN - Tim Anderson | C211: INVESTO_SIS_024 | D211: 17250 | E211: 0
A212: Investors Group | B212: Fusion - Dave Timlick | C212: INVESTO_SIS_025 | D212: 19312.5 | E212: 0
A213: Investors Group | B213: Private Wealth Mgmt & Fusion | C213: INVESTO_SIS_026 | D213: 12112.5 | E213: 0
A214: Investors Group | B214: Marketing Planner - Stacey Kuz | C214: INVESTO_SIS_027 | D214: 0 | E214: 0
A215: Investors Group | B215: Compensation Vitality - Didier | C215: INVESTO_SIS_028 | D215: 11392.5 | E215: 0
A216: Investors Group | B216: Internal Orders Project - Vibh | C216: INVESTO_SIS_029 | D216: 14647.5 | E216: 0
A217: Investors Group | B217: Aquarius - Gerald Baumgartner | C217: INVESTO_SIS_030 | D217: 17940 | E217: 0
A218: Investors Group | B218: Gagan Gill - Fusion | C218: INVESTO_SIS_031 | D218: 14310 | E218: 0
A219: Investors Group | B219: Shamit Bal | C219: INVESTO_SIS_032 | D219: 11394 | E219: 0
A220: ITC Construction Group | B220: IT Strategy Project. | C220: ITC_SIS_001 | D220: 14600 | E220: 0
A221: JEA PENSIONS | B221: JEA DEVELOPMENT SERVICES | C221: JEAPENS_SIS_002 | D221: 49960 | E221: 0
A222: Kal Tire | B222: CORE BUS HRS - 7:30AM - 5:00PM | C222: KALTIRE_AMS_001 | D222: 83785.09 | E222: 0
A223: Kal Tire | B223: PEOPLESOFT SUPPORT - ON CALL | C223: KALTIRE_AMS_003 | D223: 1800 | E223: 0
A224: Kal Tire | B224: SharePoint Support | C224: KALTIRE_AMS_004 | D224: 3360 | E224: 0
A225: Kal Tire | B225: PeopleSoft Financials Upgrade | C225: KALTIRE_SIS_036 | D225: 0 | E225: 0
A226: Kal Tire | B226: PS Functional Lead Analyst | C226: KALTIRE_SIS_041 | D226: 20625 | E226: 0
A227: Kal Tire | B227: DBA Assistance | C227: KALTIRE_SIS_045 | D227: 910 | E227: 0
A228: Kal Tire | B228: SharePoint Architecture Assist | C228: KALTIRE_SIS_046 | D228: 225 | E228: 0
A229: KooL-I.P. Solutions Corp. | B229: CPSBC - Sundeep Long | C229: KOOLIP_SIS_001 | D229: 0 | E229: 0
A230: Leading Matters Consulting Inc | B230: ASDT Communications 2014 | C230: LEAMAT_MCS_002 | D230: 0 | E230: 0
A231: Manitoba Family Services | B231: SP Development, Enhancement | C231: FAMILYS_SIS_007 | D231: 17250 | E231: 0
A232: Manitoba Housing and Renewal Corp | B232: PM - Scoping Phase 3 - D Llyod | C232: MBHOUSE_SIS_026 | D232: 0 | E232: 0
A233: Manitoba Housing and Renewal Corp | B233: Business Analyst _ Wong | C233: MBHOUSE_SIS_027 | D233: 0 | E233: 0
A234: Manitoba Housing and Renewal Corp | B234: Project Manager _ Lloyd | C234: MBHOUSE_SIS_028 | D234: 0 | E234: 0
A235: Manitoba Housing and Renewal Corp | B235: Business Analyst - Wong | C235: MBHOUSE_SIS_029 | D235: 0 | E235: 0
A236: Manitoba Housing and Renewal Corp | B236: PM SocialHousing,PM MGMT PHIII | C236: MBHOUSE_SIS_030 | D236: 18819.5 | E236: 0
A237: Manitoba Housing and Renewal Corp | B237: Bus Analyst _ Wong | C237: MBHOUSE_SIS_031 | D237: 16200 | E237: 0
A238: Medplus Inc | B238: BC SUPPORT | C238: MEDPLUS_SIS_002 | D238: 40469.31 | E238: 0
A239: Mitacs Inc | B239: Mol business req'mts project | C239: MITACS_SIS_002 | D239: 0 | E239: 0
A240: Mitacs Inc | B240: Data retention | C240: MITACS_SIS_003 | D240: 14560 | E240: 0
A241: Mountain Equipment Co-op | B241: Phase 2 BI Project | C241: MEC_SIS_005 | D241: 0 | E241: 0
A242: Mountain Equipment Co-op | B242: BI Maintenance | C242: MEC_SIS_006 | D242: 3930 | E242: 0
A243: Mountain Equipment Co-op | B243: MEC Phase 3 BI - Marketing | C243: MEC_SIS_008 | D243: 0 | E243: 0
A244: Mountain Equipment Co-op | B244: BI PM | C244: MEC_SIS_009 | D244: 0 | E244: 0
A245: Mountain Equipment Co-op | B245: Phase 4 Finance | C245: MEC_SIS_010 | D245: 15000 | E245: 0
A246: Mountain Equipment Co-op | B246: BI TRAINING | C246: MEC_SIS_011 | D246: 0 | E246: 0
A247: Mountain Equipment Co-op | B247: BI MarketingAutomation | C247: MEC_SIS_012 | D247: 23910 | E247: 0
A248: MTS Allstream Inc | B248: MTS - SDI PROJECTS | C248: MTSALLS_SIS_021 | D248: 19500 | E248: 0
A249: MTS Allstream Inc | B249: PDC Project Manager | C249: MTSALLS_SIS_047 | D249: 0 | E249: 0
A250: MTS Allstream Inc | B250: MTS AMS Development | C250: MTSALLS_SIS_050 | D250: 100640 | E250: 0
A251: MTS Allstream Inc | B251: Wireless Channel Enablement - | C251: MTSALLS_SIS_051 | D251: 19045 | E251: 0
A252: Nexen Inc. | B252: Mike Johnson - Sr. Developer | C252: NEXEN_SIS_001 | D252: 21840 | E252: 0
A253: NGRAIN Corporation | B253: Dynamics GP Support Work | C253: NGRAINC_SIS_003 | D253: -700 | E253: 0
A254: NGRAIN Corporation | B254: Software Maintenance FY14/15 | C254: NGRAINC_SIS_006 | D254: 0 | E254: 0
A255: NGRAIN Corporation | B255: Dynamics GP - Chart of Account | C255: NGRAINC_SIS_007 | D255: 1050 | E255: 0
A256: Northgate Information Solutions Canada | B256: HAL - AMS and Hosting | C256: FHSHAL_AMS_001 | D256: 77334.350000000006 | E256: 0
A257: Northgate Information Solutions Canada | B257: AMS services - M&S | C257: FHSHAL_AMS_002 | D257: 33996.410000000003 | E257: 0
A258: Northgate Information Solutions Canada | B258: Year 1 AMS Set-up | C258: FHSHAL_AMS_003 | D258: 1921.46 | E258: 0
A259: Northgate Information Solutions Canada | B259: HAL - PeopleSoft | C259: FHSHAL_SIS_001 | D259: 0 | E259: 0
A260: NWT Dept of Health and Social Services | B260: REC TIME-NWT EMR PROJECT | C260: GVTNWT_SIS_003 | D260: 73830 | E260: 0
A261: NWT Dept of Health and Social Services | B261: HSS eHealth and Social Service | C261: GVTNWT_SIS_006 | D261: 0 | E261: 0
A262: Pacific Blue Cross | B262: PIR IT Support 830326 | C262: PBC_SIS_010 | D262: 78539.75 | E262: 0
A263: Pacific Blue Cross | B263: ACES P2 Core QA UAT (0268) | C263: PBC_SIS_034 | D263: 0 | E263: 0
A264: Pacific Blue Cross | B264: ACES Release 2.1-Stage 1(0502) | C264: PBC_SIS_035 | D264: 0 | E264: 0
A265: Pacific Blue Cross | B265: 0523 HBT Data Delivery - ACES | C265: PBC_SIS_043 | D265: 0 | E265: 0
A266: Pacific Blue Cross | B266: MPPC project | C266: PBC_SIS_044 | D266: 0 | E266: 0
A267: Pacific Blue Cross | B267: Provider Registry Requirements | C267: PBC_SIS_049 | D267: 0 | E267: 0
A268: Pacific Blue Cross | B268: ACES Load Unconverted Cl(0508) | C268: PBC_SIS_050 | D268: 0 | E268: 0
A269: Pacific Blue Cross | B269: ACES Claims Transfer (0551) | C269: PBC_SIS_051 | D269: 11534.5 | E269: 0
A270: Pacific Blue Cross | B270: ACES Integration (0557) | C270: PBC_SIS_052 | D270: 0 | E270: 0
A271: Pacific Blue Cross | B271: ACES - E&D Claim Updates-0139 | C271: PBC_SIS_053 | D271: 9853 | E271: 0
A272: Pacific Blue Cross | B272: ACES Release II.1 2015 (0570) | C272: PBC_SIS_054 | D272: 67260 | E272: 0
A273: Packers Plus Energy Services | B273: Consulting Services | C273: PACKERS_SIS_001 | D273: 27300 | E273: 0
A274: Pason Systems Inc. | B274: AMS Project | C274: PASON_AMS_001 | D274: 0 | E274: 0
A275: Pason Systems Inc. | B275: MS SharePoint AMS | C275: PASON_AMS_002 | D275: 13600 | E275: 0
A276: Plains Midstream Canada ULC | B276: AMS Fixed Price | C276: PLAINS_AMS_002 | D276: 29900 | E276: 0
A277: Plains Midstream Canada ULC | B277: Plains Midstream Integration | C277: PLAINS_SIS_001 | D277: 20125 | E277: 0
A278: Plains Midstream Canada ULC | B278: HRIS Project - BA role | C278: PLAINS_SIS_005 | D278: 0 | E278: 0
A279: Plains Midstream Canada ULC | B279: John Hall - 1030964 | C279: PLAINS_SIS_009 | D279: 25117.5 | E279: 0
A280: Plains Midstream Canada ULC | B280: BizTalk Environment | C280: PLAINS_SIS_012 | D280: 8745 | E280: 0
A281: Plains Midstream Canada ULC | B281: Dynamics AX Licenses | C281: PLAINS_SIS_013 | D281: 0 | E281: 0
A282: Plains Midstream Canada ULC | B282: SharePoint UPG - PMC & Solutio | C282: PLAINS_SIS_014 | D282: 20655 | E282: 0
A283: Plains Midstream Canada ULC | B283: Atlas Licenses | C283: PLAINS_SIS_015 | D283: 0 | E283: 71651.8
A284: Princess Auto | B284: Project Manager - Yanik Souris | C284: PRINCES_SIS_002 | D284: 17393.75 | E284: 0
A285: Princess Auto | B285: SIS T&M Template | C285: PRINCES_SIS_004 | D285: 15277.5 | E285: 0
A286: Princess Auto | B286: Avanti Project - Hong Ning | C286: PRINCES_SIS_005 | D286: 0 | E286: 0
A287: Prov Health Services Authority | B287: Integration Analyst | C287: PHSA_SIS_015 | D287: 0 | E287: 0
A288: Prov Health Services Authority | B288: PLIS Results Distribution PM | C288: PHSA_SIS_020 | D288: 0 | E288: 0
A289: Pure Technologies Ltd. | B289: PM - Epicore ERP | C289: PURETEC_SIS_001 | D289: 5192.5 | E289: 0
A290: Real Estate Council of Alberta (RECA) | B290: Real Estate Council | C290: RECA_SIS_002 | D290: 93921.83 | E290: 0
A291: RedMane Technology | B291: BA Mantitoba Curam Scoping Ph | C291: REDMANE_SIS_001 | D291: 13770 | E291: 0
A292: Sask Workers' Compensation Board | B292: Eclipse - Tim Chapman | C292: WCBSK_SIS_002 | D292: 0 | E292: 0
A293: Sask Workers' Compensation Board | B293: Senior Developer - Tim Chapman | C293: WCBSK_SIS_007 | D293: 15750 | E293: 0
A294: Saskatchewan Info and Tech Office | B294: ITO - Robbie Zhang | C294: SASKINF_AMS_006 | D294: 12768 | E294: 0
A295: Saskatchewan Justice | B295: Admin Collection Enforcement | C295: SKJUSTI_SIS_004 | D295: 64240 | E295: 300
A296: Seaspan Ship Management Ltd | B296: BI TACTICAL DATA MART | C296: SEASPAN_SIS_005 | D296: 0 | E296: 0
A297: Seaspan Ship Management Ltd | B297: BI Maintenance | C297: SEASPAN_SIS_007 | D297: 0 | E297: 0
A298: Shaw Communications Inc. | B298: CBS Billing Delivery 2012-2014 | C298: SHAWCOM_AMS_002 | D298: 240801 | E298: 0
A299: Simon Fraser University | B299: Information Technology Service | C299: SFU_SIS_001 | D299: 32419.690000000002 | E299: 0
A300: Sound Dymax Inc. | B300: ATB | C300: SDYM_SIS_002 | D300: 3675 | E300: 0
A301: Sound Dymax Inc. | B301: IFP | C301: SDYM_SIS_003 | D301: 18243.75 | E301: 0
A302: Springer Creek Forest Products Ltd. | B302: WISE Support | C302: SPRCRKF_SIS_001 | D302: 0 | E302: 0
A303: Stella-Jones Canada Inc | B303: Bell Pole - Fibre Trak | C303: STJONES_AMS_001 | D303: 1710 | E303: 0
A304: Strike Energy Services Inc. | B304: Strike AMS Project | C304: STRIKE_AMS_001 | D304: 0 | E304: 0
A305: Strike Energy Services Inc. | B305: Change Management Analyst | C305: STRIKE_SIS_008 | D305: 0 | E305: 0
A306: Telus Communications Company | B306: Pacific Autism Fam IT Req | C306: TELCOMM_SIS_001 | D306: 11190 | E306: 0
A307: Telus Sourcing Solutions | B307: K-12 HR Payroll Pilot Project | C307: TELSOU_SIS_003 | D307: 0 | E307: 0
A308: Telus Sourcing Solutions | B308: BSA for FP2 Upgrade | C308: TELSOU_SIS_005 | D308: 0 | E308: 0
A309: Telus Sourcing Solutions | B309: TLAM Project | C309: TELSOU_SIS_007 | D309: 121679.56 | E309: 0
A310: Telus Sourcing Solutions | B310: BC LDB HCM 9.2 Upgrade | C310: TELSOU_SIS_010 | D310: 0 | E310: 0
A311: Telus Sourcing Solutions | B311: VBE-PS Fin.Supply Chain Mgmt | C311: TELSOU_SIS_012 | D311: -279.43 | E311: 0
A312: Telus Sourcing Solutions | B312: K-12 HR Pay and VSB Pilot | C312: TELSOU_SIS_013 | D312: 316384.2 | E312: 0
A313: Telus Sourcing Solutions | B313: BC LDB Phase II | C313: TELSOU_SIS_017 | D313: 0 | E313: 0
A314: Telus Sourcing Solutions | B314: PS User Productivity Kit (UPK) | C314: TELSOU_SIS_019 | D314: 5312.5 | E314: 0
A315: Telus Sourcing Solutions | B315: PS - Post Implementation | C315: TELSOU_SIS_020 | D315: 0 | E315: 0
A316: Telus Sourcing Solutions/BC Health Autho | B316: HSSBC Consolidation Due Dilige | C316: TSSI_SIS_001 | D316: 0 | E316: 0
A317: Telus Sourcing Solutions/BC Health Autho | B317: HSSBC Cons.Due Diligence-CR001 | C317: TSSI_SIS_002 | D317: 13727.68 | E317: 0
A318: Telus Sourcing Solutions/BC Health Autho | B318: HCM 9.2 Upgrade Project-Plan | C318: TSSI_SIS_003 | D318: 32257.5 | E318: 0
A319: Tembec Industries Inc | B319: WISE SUPPORT-TEMBEC | C319: TEMBEC_AMS_001 | D319: 1620 | E319: 0
A320: Tervita (formerly CCS ) Corporation | B320: HCM 9.1 Implementation Project | C320: CCSCORP_SIS_002 | D320: 0 | E320: 0
A321: TimberWest Forest Corp. | B321: TimberWest Dynamics AMS | C321: TIMBER_AMS_007 | D321: 3660 | E321: 0
A322: TimberWest Forest Corp. | B322: Dynamics T&E Implementation | C322: TIMBER_SIS_008 | D322: 0 | E322: 0
A323: TimberWest Forest Corp. | B323: Dynamics Addition | C323: TIMBER_SIS_009 | D323: 0 | E323: 0
A324: TimberWest Forest Corp. | B324: Dynamics license Renewal | C324: TIMBER_SIS_010 | D324: 0 | E324: 0
A325: Tolko Industries Ltd | B325: Tolko-TN Division | C325: TOLKO_AMS_002 | D325: 4560 | E325: 0
A326: Tolko Industries Ltd | B326: Tolko-OK Division | C326: TOLKO_AMS_004 | D326: 3000 | E326: 0
A327: Tolko Industries Ltd | B327: Tolko-CR Division | C327: TOLKO_AMS_005 | D327: 870 | E327: 0
A328: Tolko Industries Ltd | B328: Microsoft Dynamics AX2012 R2 | C328: TOLKO_SIS_010 | D328: 291036.25 | E328: 0
A329: Unit4 Business Software Corporation | B329: Business Analysis | C329: UNIT4_SIS_001 | D329: 10153 | E329: 0
A330: University of British Columbia | B330: AMS methodology Rita Dalgliesh | C330: UBC_AMS_001 | D330: 10530 | E330: 0
A331: University of British Columbia | B331: OPS Stabilization | C331: UBC_SIS_007 | D331: 0 | E331: 0
A332: University of British Columbia | B332: FRO UBCO rollout | C332: UBC_SIS_008 | D332: 51577.5 | E332: 0
A333: University of British Columbia | B333: OPT phase 2 | C333: UBC_SIS_009 | D333: 57732.5 | E333: 0
A334: University of British Columbia | B334: PS Cathy Lenz | C334: UBC_SIS_010 | D334: 0 | E334: 0
A335: University of Calgary | B335: CONTRACT : 2014ICA0095 | C335: UNIVCGY_SIS_001 | D335: 0 | E335: 0
A336: University of Manitoba | B336: Enterprise IT Goverance Ph 1 | C336: UNIVMB_MCS_003 | D336: 0 | E336: 0
A337: University of Manitoba | B337: IT Organizational Model, PH 1 | C337: UNIVMB_MCS_004 | D337: -430.47 | E337: 0
A338: University of Manitoba | B338: Organizational Chg Mgmt Lead | C338: UNIVMB_MCS_005 | D338: 20475 | E338: 0
A339: Vancouver Board of Education | B339: Project Management | C339: VSB_SIS_002 | D339: 12160 | E339: 0
A340: Vancouver Board of Education | B340: PS- Cathy Lenz | C340: VSB_SIS_003 | D340: 13175 | E340: 0
A341: Vancouver International Airport Auth. | B341: ABC Project Assistance | C341: YVR_SIS_019 | D341: 0 | E341: 0
A342: Vancouver International Airport Auth. | B342: ABC Plus ¿ US Passport Holders | C342: YVR_SIS_020 | D342: 12540 | E342: 0
A343: Wawanesa Mutual Insurance | B343: Data Analyst - Bevan Klassen | C343: WAWANES_SIS_004 | D343: 0 | E343: 0
A344: Wawanesa Mutual Insurance | B344: Data Analyst - Joy Sheldon | C344: WAWANES_SIS_005 | D344: 0 | E344: 0
A345: Wawanesa Mutual Insurance | B345: Bus Analyst - Andrew Dunsford | C345: WAWANES_SIS_006 | D345: 17250 | E345: 0
A346: Wawanesa Mutual Insurance | B346: ETL Developer - Anth Reddy | C346: WAWANES_SIS_007 | D346: 0 | E346: 0
A347: Wawanesa Mutual Insurance | B347: Bus Analyst - Simon Ip | C347: WAWANES_SIS_009 | D347: 17640 | E347: 0
A348: Wawanesa Mutual Insurance | B348: Data Analyst - Joy Sheldon | C348: WAWANES_SIS_010 | D348: 10117.5 | E348: 0
A349: Wawanesa Mutual Insurance | B349: ETL Developer - Anth Reddy | C349: WAWANES_SIS_011 | D349: 14250 | E349: 0
A350: Wawanesa Mutual Insurance | B350: Data Analyst - Bevan Klassen | C350: WAWANES_SIS_012 | D350: 18200 | E350: 0
A351: WCB Alberta | B351: WCB AB AM&SS 2014 - 2015 | C351: WCBAB_AMS_108 | D351: 35725 | E351: 0
A352: WCB Alberta | B352: WR2014A600 - IFMS Security Rev | C352: WCBAB_AMS_109 | D352: 0 | E352: 0
A353: WCB Alberta | B353: WR2014A - IFMS BI Publisher Tr | C353: WCBAB_AMS_110 | D353: 0 | E353: 0
A354: WCB Alberta | B354: WR2014A603 - IFMS Batch Review | C354: WCBAB_AMS_111 | D354: 9730 | E354: 0
A355: WCB Alberta | B355: WR2014A609 Surplus Dis. Enhanc | C355: WCBAB_AMS_112 | D355: 0 | E355: 0
A356: WCB Alberta | B356: WR2014A617 - CSSM SQR MODS | C356: WCBAB_AMS_113 | D356: 0 | E356: 0
A357: WCB Alberta | B357: WR2014A623 - INCREASE $ THRESH | C357: WCBAB_AMS_114 | D357: 0 | E357: 0
A358: WCB Alberta | B358: WR2014A631 - STALE DATED DEPOS | C358: WCBAB_AMS_115 | D358: 0 | E358: 0
A359: WCB Alberta | B359: WR2014A602-IFMS Email Function | C359: WCBAB_AMS_116 | D359: 0 | E359: 0
A360: WCB Alberta | B360: WCB Refresh U3 Oct 2014 | C360: WCBAB_AMS_117 | D360: 0 | E360: 0
A361: WCB Alberta | B361: WCB Refresh IFMS U6 Environmen | C361: WCBAB_AMS_118 | D361: 0 | E361: 0
A362: WCB Alberta | B362: WR2014A640-PAD INVOICE AMOUNT | C362: WCBAB_AMS_119 | D362: 0 | E362: 0
A363: WCB Alberta | B363: WR2014A647-Pad Invoice Change | C363: WCBAB_AMS_120 | D363: 1260 | E363: 0
A364: WCB Alberta | B364: WR2015A661-Surplus Distri.Test | C364: WCBAB_AMS_121 | D364: 5215 | E364: 0
A365: WCB Alberta | B365: WCB DB2 Connect v10.5 Upgrade | C365: WCBAB_AMS_122 | D365: 1715 | E365: 0
A366: WCB Alberta | B366: WCB PeopleSoft 9.1 Upgrade | C366: WCBAB_SIS_005 | D366: 0 | E366: 0
A367: Winnipeg Reg Health Authority | B367: IT-040-MB, ACS-080 Systems Ana | C367: WINREGH_SIS_065 | D367: 0 | E367: 0
A368: Winnipeg Reg Health Authority | B368: IT-058-MB, RFR ACS-085 Testing | C368: WINREGH_SIS_067 | D368: 0 | E368: 0
A369: Winnipeg Reg Health Authority | B369: IT-723-MB-Technology Architect | C369: WINREGH_SIS_076 | D369: 0 | E369: 0
A370: Winnipeg Reg Health Authority | B370: FDA-003 Project Manager | C370: WINREGH_SIS_077 | D370: 22785 | E370: 0
A371: Winnipeg Reg Health Authority | B371: Project Manager, Dennis Siemen | C371: WINREGH_SIS_078 | D371: 13300 | E371: 0
A372: Winnipeg Reg Health Authority | B372: PTS-001 Business Analyst | C372: WINREGH_SIS_079 | D372: 15500 | E372: 0
A373: Winnipeg Reg Health Authority | B373: Project Manager, Brent Wilson | C373: WINREGH_SIS_080 | D373: 17962.5 | E373: 0
A374: Winnipeg Reg Health Authority | B374: Project Manager, Kevin Roberts | C374: WINREGH_SIS_081 | D374: 19792.5 | E374: 0
A375: Winnipeg Reg Health Authority | B375: ACS-100 Business Analyst | C375: WINREGH_SIS_082 | D375: 0 | E375: 0
A376: Winnipeg Reg Health Authority | B376: HIS-017 Systems Analyst | C376: WINREGH_SIS_083 | D376: 17906.25 | E376: 0
A377: Winnipeg Reg Health Authority | B377: HIS-016 Business Analyst | C377: WINREGH_SIS_084 | D377: 16280 | E377: 0
A378: Winnipeg Reg Health Authority | B378: HIS-015 Training Specialist | C378: WINREGH_SIS_085 | D378: 18875 | E378: 0
A379: Winnipeg Reg Health Authority | B379: ACS-101 Business Analyst | C379: WINREGH_SIS_086 | D379: 0 | E379: 0
A380: Winnipeg Reg Health Authority | B380: PAN-013 Project Manager | C380: WINREGH_SIS_087 | D380: 22785 | E380: 0
A381: Winnipeg Reg Health Authority | B381: ACS-103 Business Analyst | C381: WINREGH_SIS_088 | D381: 0 | E381: 0
A382: Winnipeg Reg Health Authority | B382: ACS-104 Project Manager | C382: WINREGH_SIS_089 | D382: 0 | E382: 0
A383: Winnipeg Reg Health Authority | B383: Technology Architect - Al Amyo | C383: WINREGH_SIS_090 | D383: 20250 | E383: 0
A384: Wipro Solutions Canada Ltd. | B384: Alicia Wing - T & M | C384: ATCO_SIS_005 | D384: 0 | E384: 0
A385: Wipro Solutions Canada Ltd. | B385: Debbie Fox - T & M | C385: ATCO_SIS_008 | D385: 0 | E385: 0
A386: Wipro Solutions Canada Ltd. | B386: Stewart St. Dennis - T & M | C386: ATCO_SIS_009 | D386: 0 | E386: 0
A387: Wipro Solutions Canada Ltd. | B387: Juanita Ozuna - T & M | C387: ATCO_SIS_011 | D387: 0 | E387: 0
A388: Wipro Solutions Canada Ltd. | B388: Juanita Ozuna - T & M | C388: ATCO_SIS_012 | D388: 0 | E388: 0
A389: Workers Comp Board of Manitoba | B389: Sr. Bus Analyst - Compliance | C389: WCBMB_SIS_002 | D389: 16660.64 | E389: 0
A390: WorkSafeBC | B390: Identity Management, Phase 1 | C390: WRKSFBC_SIS_018 | D390: 24689 | E390: 0
A391: WorkSafeBC | B391: Sunsetting of CMS OD KevinLee | C391: WRKSFBC_SIS_019 | D391: 1200 | E391: 0
A392: WorkSafeBC | B392: IDAM CR Phase 1.5 Layer 7 | C392: WRKSFBC_SIS_020 | D392: 0 | E392: 0
A393: Astra Oil Company LLC | B393: Astra Dynamics AMS | C393: ASTRA_AMS_001 | D393: ='Jan Actuals USD'!R[-391]C[1] -> 7725.0595040000007
D395: =SUM(R[-393]C:R[-1]C) -> 7547493.9695039997 | E395: =SUM(R[-393]C:R[-1]C) -> 160631.58000000002
D396: =R[-1]C+R[-1]C[1] -> 7708125.5495039998
D397: =R[-2]C-R[-4]C -> 7539768.9100000001

Sheet: Jan Act vs Frcst
A1: Jan 2015 ACTUAL VS. FORECAST - BY ACCT MGR | H1: Jan 2015 ACTUAL VS. FORECAST - BY ACCT MGR - BY CLIENT | P1: Service Type | Q1: Managed Services | R1: Jan 2015 ACTUAL VS. FORECAST - BY ACCT MGR - BY CLIENT - AMS ONLY
A3: Revenue | B3: Market | C3: Account Manager | D3: Actual | E3: Forecast | F3: Variance | H3: Revenue | I3: Market | J3: Account Manager | K3: Client Name | L3: Actual | M3: Forecast | N3: Variance | P3: Revenue | Q3: Market | R3: Account Manager | S3: Client Name | T3: Actual | U3: Forecast | V3: Variance
A4: Services | B4: Calgary | C4: Frandsen, Cory | D4: 641410.28950399999 | E4: 539550 | F4: 101860.28950399999 | H4: Services | I4: Calgary | J4: Frandsen, Cory | K4: Alliance Pipelines | L4: 0 | M4: 0 | N4: 0 | P4: Services | Q4: Calgary | R4: Frandsen, Cory | S4: Altalink Management Ltd | T4: 124848.88 | U4: 127800 | V4: -2951.1199999999953
C5: Hulme, Dennis | D5: 26541.72 | E5: 23000 | F5: 3541.7200000000012 | K5: Altalink Management Ltd | L5: 122906.38 | M5: 135300 | N5: -12393.619999999995 | S5: Astra Oil Company LLC | T5: 7725.0595040000007 | U5: 5200 | V5: 2525.0595040000007
C6: Johnson, Sarah | D6: 619039.49000000011 | E6: 618400 | F6: 639.4900000001071 | K6: Astra Energy Canada Inc. | L6: 0 | M6: 0 | N6: 0 | S6: Bellatrix | T6: 0 | U6: 6850 | V6: -6850
C7: Milloy, Brian | D7: 477505 | E7: 471285 | F7: 6220 | K7: Astra Oil Company LLC | L7: 7725.0595040000007 | M7: 5200 | N7: 2525.0595040000007 | S7: Connacher Oil and Gas Limited | T7: 455 | U7: 2500 | V7: -2045
C8: Semeniuk, Darcy | D8: 190852.23 | E8: 125000 | F8: 65852.23000000001 | K8: Bellatrix | L8: 0 | M8: 6850 | N8: -6850 | S8: Encana Services Company Ltd. | T8: 60930.25 | U8: 59750 | V8: 1180.25
C9: Van Dorp, Abe | D9: 0 | E9: 0 | F9: 0 | K9: Cenovus Energy Inc | L9: 14220 | M9: 29000 | N9: -14780 | S9: Pason Systems Inc. | T9: 13600 | U9: 3700 | V9: 9900
B10: Calgary Total | D10: 1955348.7295039999 | E10: 1777235 | F10: 178113.72950399993 | K10: City of Calgary | L10: 30007.5 | M10: 12000 | N10: 18007.5 | S10: Plains Midstream Canada ULC | T10: 29900 | U10: 29000 | V10: 900
B11: Edmonton | C11: Coward, Craig | D11: 286702.32 | E11: 217483 | F11: 69219.320000000007 | K11: Connacher Oil and Gas Limited | L11: 455 | M11: 2500 | N11: -2045 | S11: Tervita (formerly CCS ) Corporation | T11: 0 | U11: 0 | V11: 0
C12: Groshong, Willis | D12: 174909.72 | E12: 199000 | F12: -24090.28 | K12: Encana Services Company Ltd. | L12: 60930.25 | M12: 71000 | N12: -10069.75 | R12: Frandsen, Cory Total | T12: 237459.18950400001 | U12: 234800 | V12: 2659.189504000009
C13: Hulme, Dennis | D13: 73830 | E13: 65000 | F13: 8830 | K13: Ensign Energy Services | L13: 36000 | M13: 36000 | N13: 0 | R13: Milloy, Brian | S13: Canadian Pacific Railway | T13: 20245 | U13: 17600 | V13: 2645
C14: Kraus, Carey | D14: 128670.5 | E14: 112475 | F14: 16195.5 | K14: HP Co Canada- Cenovus | L14: 102769.27 | M14: 0 | N14: 102769.27 | S14: Gibson Energy | T14: 0 | U14: 0 | V14: 0
C15: Van Dorp, Abe | D15: 180331.25 | E15: 198831.38537395932 | F15: -18500.135373959318 | K15: Mawer Investment Banking | L15: 0 | M15: 0 | N15: 0 | S15: Shaw Communications Inc. | T15: 240801 | U15: 282000 | V15: -41199
B16: Edmonton Total | D16: 844443.79 | E16: 792789.38537395932 | F16: 51654.404626040719 | K16: Nexen | L16: 21840 | M16: 19000 | N16: 2840 | S16: Strike Energy Services Inc. | T16: 0 | V16: 0
B17: Regina | C17: Kostelnyk, Janice | D17: 40460.5 | E17: 42300 | F17: -1839.5 | K17: Nexen | L17: 0 | M17: 0 | N17: 0 | R17: Milloy, Brian Total | T17: 261046 | U17: 299600 | V17: -38554
C18: Thomson, Dan | D18: 64240 | E18: 65559 | F18: -1319 | K18: Packers Plus Energy Services | L18: 27300 | M18: 25000 | N18: 2300 | R18: Semeniuk, Darcy | S18: Cenovus Energy Inc | T18: 0 | U18: 5000 | V18: -5000
C19: Wildman, Tim | D19: 39565.660000000003 | E19: 35000 | F19: 4565.6600000000035 | K19: Pason Systems Inc. | L19: 13600 | M19: 3700 | N19: 9900 | S19: HP Co Canada- Cenovus | T19: 190852.23 | U19: 120000 | V19: 70852.23000000001
B20: Regina Total | D20: 144266.16 | E20: 142859 | F20: 1407.1600000000035 | K20: Plains Midstream Canada ULC | L20: 104542.5 | M20: 104000 | N20: 542.5 | R20: Semeniuk, Darcy Total | T20: 190852.23 | U20: 125000 | V20: 65852.23000000001
B21: Vancouver | C21: Collins, Carol | D21: 1094696.1099999999 | E21: 934800 | F21: 159896.10999999987 | K21: Pure Technologies | L21: 5192.5 | M21: 0 | N21: 5192.5 | Q21: Calgary Total | T21: 689357.41950399999 | U21: 659400 | V21: 29957.41950399999
C22: Fabi, Roger | D22: 66790 | E22: 79600 | F22: -12810 | K22: Real Estate Council of Alberta (RECA | L22: 0 | M22: 0 | N22: 0 | Q22: Edmonton | R22: Coward, Craig | S22: Alberta Culture and Tourism | T22: 189525.16 | U22: 147483 | V22: 42042.16
C23: Hayden, Carolyn | D23: 150464.32000000001 | E23: 112600 | F23: 37864.320000000007 | K23: Real Estate Council of Alberta (RECA) | L23: 93921.83 | M23: 90000 | N23: 3921.8300000000017 | S23: HP Co Canada | T23: 97177.16 | U23: 70000 | V23: 27177.160000000003
C24: Hughes, Bev | D24: 52560 | E24: 35000 | F24: 17560 | K24: Tervita (formerly CCS ) Corporation | L24: 0 | M24: 0 | N24: 0 | R24: Coward, Craig Total | T24: 286702.32 | U24: 217483 | V24: 69219.320000000007
C25: Hunter, Rick | D25: 227573.27000000002 | E25: 244500 | F25: -16926.729999999981 | J25: Frandsen, Cory Total | L25: 641410.28950399999 | M25: 539550 | N25: 101860.28950399999 | R25: Groshong, Willis | S25: 630 CHED Santas Anonymous | T25: 0 | U25: 0 | V25: 0
C26: McNeil, Graeme | D26: 12797.5 | E26: 0 | F26: 12797.5 | J26: Hulme, Dennis | K26: Alberta Health Services | L26: 26541.72 | M26: 23000 | N26: 3541.7200000000012 | S26: Alberta Energy | T26: 0 | U26: 7500 | V26: -7500
C27: Thomson, Dan | D27: 0 | E27: 0 | F27: 0 | J27: Hulme, Dennis Total | L27: 26541.72 | M27: 23000 | N27: 3541.7200000000012 | S27: ASHC Housing Corp | T27: 0 | V27: 0
B28: Vancouver Total | D28: 1604881.2 | E28: 1406500 | F28: 198381.19999999995 | J28: Johnson, Sarah | K28: Alberta Health Services | L28: 619039.49000000011 | M28: 618400 | N28: 639.4900000001071 | S28: Canadian Western Bank | T28: 15640 | U28: 16000 | V28: -360
B29: Victoria | C29: Brisbane, Ross | D29: 237019 | E29: 240000 | F29: -2981 | K29: ATB Calgary | L29: 0 | M29: 0 | N29: 0 | S29: Christmas Bureau of Edmonton | T29: 0 | U29: 0 | V29: 0
C30: Fabi, Roger | D30: 478945.12999999995 | E30: 483500 | F30: -4554.8700000000536 | J30: Johnson, Sarah Total | L30: 619039.49000000011 | M30: 618400 | N30: 639.4900000001071 | S30: Northgate Information Solutions Canada | T30: 113252.22 | U30: 104000 | V30: 9252.2200000000012
C31: Hayden, Carolyn | D31: 11190 | F31: 11190 | J31: Milloy, Brian | K31: Calgary Airport Authority | L31: 141750.25 | M31: 128200 | N31: 13550.25 | R31: Groshong, Willis Total | T31: 128892.22 | U31: 127500 | V31: 1392.2200000000012
C32: McNeil, Graeme | D32: 786549.84000000008 | E32: 671650 | F32: 114899.84000000008 | K32: Calgary Immigrant Womens Assoc | L32: -450 | M32: 0 | N32: -450 | R32: Kraus, Carey | S32: City of Edmonton | T32: 21702.5 | U32: 14250 | V32: 7452.5
C33: Robinson, Charlie | D33: 584002.67999999993 | E33: 474400 | F33: 109602.67999999993 | K33: Canadian Pacific Railway | L33: 44025 | M33: 40785 | N33: 3240 | S33: WCB Alberta | T33: 53645 | U33: 48225 | V33: 5420
B34: Victoria Total | D34: 2097706.65 | E34: 1869550 | F34: 228156.64999999991 | K34: CEDA International Corporation | L34: 29460 | M34: 0 | N34: 29460 | R34: Kraus, Carey Total | T34: 75347.5 | U34: 62475 | V34: 12872.5
B35: Winnipeg | C35: Kostelnyk, Janice | D35: 560040.5 | E35: 495345 | F35: 64695.5 | K35: Gibson Energy | L35: 0 | M35: 0 | N35: 0 | R35: Van Dorp, Abe | S35: Alberta Solicitor General | T35: 61935.87 | U35: 83831.385373959318 | V35: -21895.515373959315
C36: Wildman, Tim | D36: 340806.69 | E36: 356168 | F36: -15361.309999999998 | K36: Osum Oil Sands Corp | L36: 0 | M36: 0 | N36: 0 | R36: Van Dorp, Abe Total | T36: 61935.87 | U36: 83831.385373959318 | V36: -21895.515373959315
B37: Winnipeg Total | D37: 900847.19 | E37: 851513 | F37: 49334.190000000061 | K37: Shaw Communications Inc. | L37: 240801 | M37: 290300 | N37: -49499 | Q37: Edmonton Total | T37: 552877.91 | U37: 491289.38537395932 | V37: 61588.524626040715
A38: Services Total | D38: 7547493.7195040006 | E38: 6840446.3853739593 | F38: 707047.33413003944 | K38: Sound Dymax Inc. | L38: 21918.75 | M38: 12000 | N38: 9918.75 | Q38: Regina | R38: Kostelnyk, Janice | S38: Saskatchewan Info and Tech Office | T38: 12768 | U38: 14000 | V38: -1232
A39: M&S | B39: Calgary | C39: Frandsen, Cory | D39: 30437 | E39: 0 | F39: 30437 | K39: Strike Energy Services Inc. | L39: 0 | N39: 0 | R39: Kostelnyk, Janice Total | T39: 12768 | U39: 14000 | V39: -1232
B40: Calgary Total | D40: 30437 | E40: 0 | F40: 30437 | K40: University of Calgary | L40: 0 | M40: 0 | N40: 0 | R40: Thomson, Dan | S40: Saskatchewan Justice | T40: 0 | U40: 0 | V40: 0
B41: Edmonton | C41: Coward, Craig | D41: 0 | F41: 0 | J41: Milloy, Brian Total | L41: 477505 | M41: 471285 | N41: 6220 | R41: Thomson, Dan Total | T41: 0 | U41: 0 | V41: 0
C42: Van Dorp, Abe | D42: 0 | E42: 0 | F42: 0 | J42: Semeniuk, Darcy | K42: Cenovus Energy Inc | L42: 0 | M42: 5000 | N42: -5000 | Q42: Regina Total | T42: 12768 | U42: 14000 | V42: -1232
B43: Edmonton Total | D43: 0 | E43: 0 | F43: 0 | K43: HP Co Canada- Cenovus | L43: 190852.23 | M43: 120000 | N43: 70852.23000000001 | Q43: Vancouver | R43: Collins, Carol | S43: Alpac Forest Products Inc | T43: 16000 | U43: 16000 | V43: 0
B44: Regina | C44: Thomson, Dan | D44: 300 | E44: 0 | F44: 300 | J44: Semeniuk, Darcy Total | L44: 190852.23 | M44: 125000 | N44: 65852.23000000001 | S44: Interfor | T44: 11659.5 | U44: 8000 | V44: 3659.5
B45: Regina Total | D45: 300 | E45: 0 | F45: 300 | J45: Van Dorp, Abe | K45: Calgary Police Service | L45: 0 | M45: 0 | N45: 0 | S45: Kal Tire | T45: 88945.09 | U45: 60000 | V45: 28945.089999999997
B46: Vancouver | C46: Collins, Carol | D46: 9836 | E46: 0 | F46: 9836 | J46: Van Dorp, Abe Total | L46: 0 | M46: 0 | N46: 0 | S46: Stella-Jones Canada Inc | T46: 1710 | U46: 0 | V46: 1710
B47: Vancouver Total | D47: 9836 | E47: 0 | F47: 9836 | I47: Calgary Total | L47: 1955348.7295039999 | M47: 1777235 | N47: 178113.72950399993 | S47: Tembec Industries Inc | T47: 1620 | U47: 0 | V47: 1620
A48: M&S Total | D48: 40573 | E48: 0 | F48: 40573 | I48: Edmonton | J48: Coward, Craig | K48: Alberta Culture and Tourism | L48: 189525.16 | M48: 147483 | N48: 42042.16 | S48: TimberWest Forest Corp. | T48: 3660 | U48: 2800 | V48: 860
A49: Product | B49: Calgary | C49: Frandsen, Cory | D49: 65758.77 | E49: 0 | F49: 65758.77 | K49: HP Co Canada | L49: 97177.16 | M49: 70000 | N49: 27177.160000000003 | S49: Tolko Industries Ltd | T49: 8430 | U49: 0 | V49: 8430
B50: Calgary Total | D50: 65758.77 | E50: 0 | F50: 65758.77 | J50: Coward, Craig Total | L50: 286702.32 | M50: 217483 | N50: 69219.320000000007 | R50: Collins, Carol Total | T50: 132024.59 | U50: 86800 | V50: 45224.59
B51: Edmonton | C51: Coward, Craig | D51: 29300 | F51: 29300 | J51: Groshong, Willis | K51: 630 CHED Santas Anonymous | L51: 0 | M51: 0 | N51: 0 | R51: Hunter, Rick | S51: University of British Columbia | T51: 10530 | U51: 16500 | V51: -5970
B52: Edmonton Total | D52: 29300 | F52: 29300 | K52: Albera Energy | L52: 0 | M52: 9000 | N52: -9000 | R52: Hunter, Rick Total | T52: 10530 | U52: 16500 | V52: -5970
B53: Vancouver | C53: Collins, Carol | D53: 0 | E53: 0 | F53: 0 | K53: Alberta Energy | L53: 0 | M53: 7500 | N53: -7500 | R53: McNeil, Graeme | S53: Insurance Corp of British Columbia(ICBC) | T53: 0 | U53: 0 | V53: 0
B54: Vancouver Total | D54: 0 | E54: 0 | F54: 0 | K54: Alberta Innovates - Technology Futures | L54: 0 | M54: 6000 | N54: -6000 | R54: McNeil, Graeme Total | T54: 0 | U54: 0 | V54: 0
B55: Victoria | C55: Robinson, Charlie | D55: 0 | E55: 0 | F55: 0 | K55: Alberta Municipal Affairs | L55: 31367.5 | M55: 34000 | N55: -2632.5 | Q55: Vancouver Total | T55: 142554.59 | U55: 103300 | V55: 39254.589999999997
B56: Victoria Total | D56: 0 | E56: 0 | F56: 0 | K56: ASHC Housing Corp | L56: 0 | N56: 0 | Q56: Victoria | R56: Brisbane, Ross | S56: HP ADVANCED SOLUTIONS INC | T56: 0 | U56: 0 | V56: 0
A57: Product Total | D57: 95058.77 | E57: 0 | F57: 95058.77 | K57: Canadian Western Bank | L57: 30290 | M57: 31000 | N57: -710 | R57: Brisbane, Ross Total | T57: 0 | U57: 0 | V57: 0
A58: Grand Total | D58: 7683125.4895040002 | E58: 6840446.3853739593 | F58: 842679.10413003899 | K58: Christmas Bureau of Edmonton | L58: 0 | M58: 0 | N58: 0 | R58: Fabi, Roger | S58: Harmac Pacific | T58: 2834.54 | U58: 5000 | V58: -2165.46
K59: City of Spruce Grove | L59: 0 | M59: 7500 | N59: -7500 | R59: Fabi, Roger Total | T59: 2834.54 | U59: 5000 | V59: -2165.46
K60: Northgate Information Solutions Canada | L60: 113252.22000000002 | M60: 104000 | N60: 9252.2200000000157 | R60: Robinson, Charlie | S60: BC Ministry of Justice | T60: 184614.31 | U60: 132000 | V60: 52614.31
A61: Service Type | B61: Managed Services | K61: Strathcona County | L61: 0 | N61: 0 | S61: International Technology Integration Inc | T61: 4004 | U61: 4000 | V61: 4
J62: Groshong, Willis Total | L62: 174909.72000000003 | M62: 199000 | N62: -24090.28 | S62: Justice Institute of British Columbia | T62: 0 | U62: 4500 | V62: -4500
A63: Revenue | B63: Market | C63: Account Manager | D63: Actual | E63: Forecast | F63: Variance | J63: Hulme, Dennis | K63: NWT Dept of Health and Social Services | L63: 73830 | M63: 65000 | N63: 8830 | R63: Robinson, Charlie Total | T63: 188618.31 | U63: 140500 | V63: 48118.31
A64: Services | B64: Calgary | C64: Frandsen, Cory | D64: 237459.18950400001 | E64: 234800 | F64: 2659.189504000009 | J64: Hulme, Dennis Total | L64: 73830 | M64: 65000 | N64: 8830 | Q64: Victoria Total | T64: 191452.85 | U64: 145500 | V64: 45952.850000000035
C65: Milloy, Brian | D65: 261046 | E65: 299600 | F65: -38554 | J65: Kraus, Carey | K65: City of Edmonton | L65: 75025.5 | M65: 64250 | N65: 10775.5 | P65: Services Total | T65: 1589010.7695040004 | U65: 1413489.3853739593 | V65: 175521.38413004088
C66: Semeniuk, Darcy | D66: 190852.23 | E66: 125000 | F66: 65852.23000000001 | K66: WCB Alberta | L66: 53645 | M66: 48225 | N66: 5420 | P66: Grand Total | T66: 1589010.7695040004 | U66: 1413489.3853739593 | V66: 175521.38413004088
B67: Calgary Total | D67: 689357.41950399999 | E67: 659400 | F67: 29957.41950399999 | K67: Wipro Solutions Canada (formerly ATCO I-Tek) | L67: 0 | M67: 0 | N67: 0
B68: Edmonton | C68: Coward, Craig | D68: 286702.32 | E68: 217483 | F68: 69219.320000000007 | J68: Kraus, Carey Total | L68: 128670.5 | M68: 112475 | N68: 16195.5
C69: Groshong, Willis | D69: 128892.22 | E69: 127500 | F69: 1392.2200000000012 | J69: Van Dorp, Abe | K69: Alberta Justice & Solicitor General | L69: 118395.38 | M69: 115000 | N69: 3395.3800000000047
C70: Kraus, Carey | D70: 75347.5 | E70: 62475 | F70: 12872.5 | K70: Alberta Solicitor General | L70: 61935.87 | M70: 83831.385373959318 | N70: -21895.515373959315
C71: Van Dorp, Abe | D71: 61935.87 | E71: 83831.385373959318 | F71: -21895.515373959315 | J71: Van Dorp, Abe Total | L71: 180331.25 | M71: 198831.38537395932 | N71: -18500.135373959318
B72: Edmonton Total | D72: 552877.91 | E72: 491289.38537395932 | F72: 61588.524626040715 | I72: Edmonton Total | L72: 844443.79 | M72: 792789.38537395932 | N72: 51654.404626040719
B73: Regina | C73: Kostelnyk, Janice | D73: 12768 | E73: 14000 | F73: -1232 | I73: Regina | J73: Kostelnyk, Janice | K73: City of Regina | L73: 0 | M73: 0 | N73: 0
C74: Thomson, Dan | D74: 0 | E74: 0 | F74: 0 | K74: Government of Saskatchewan | L74: 11942.5 | M74: 11500 | N74: 442.5
B75: Regina Total | D75: 12768 | E75: 14000 | F75: -1232 | K75: Sask Workers' Compensation Board | L75: 15750 | M75: 16800 | N75: -1050
B76: Vancouver | C76: Collins, Carol | D76: 132024.59 | E76: 86800 | F76: 45224.59 | K76: Saskatchewan Info and Tech Office | L76: 12768 | M76: 14000 | N76: -1232
C77: Hunter, Rick | D77: 10530 | E77: 16500 | F77: -5970 | J77: Kostelnyk, Janice Total | L77: 40460.5 | M77: 42300 | N77: -1839.5
C78: McNeil, Graeme | D78: 0 | E78: 0 | F78: 0 | J78: Thomson, Dan | K78: Saskatchewan Justice | L78: 64240 | M78: 65559 | N78: -1319
B79: Vancouver Total | D79: 142554.59 | E79: 103300 | F79: 39254.589999999997 | J79: Thomson, Dan Total | L79: 64240 | M79: 65559 | N79: -1319
B80: Victoria | C80: Brisbane, Ross | D80: 0 | E80: 0 | F80: 0 | J80: Wildman, Tim | K80: eHealth Saskatchewan | L80: 39565.660000000003 | M80: 35000 | N80: 4565.6600000000035
C81: Fabi, Roger | D81: 2834.54 | E81: 5000 | F81: -2165.46 | J81: Wildman, Tim Total | L81: 39565.660000000003 | M81: 35000 | N81: 4565.6600000000035
C82: Robinson, Charlie | D82: 188618.31 | E82: 140500 | F82: 48118.31 | I82: Regina Total | L82: 144266.16 | M82: 142859 | N82: 1407.1600000000035
B83: Victoria Total | D83: 191452.85 | E83: 145500 | F83: 45952.850000000035 | I83: Vancouver | J83: Collins, Carol | K83: Ainsworth Engineered | L83: 27793.27 | M83: 28000 | N83: -206.72999999999956
A84: Services Total | D84: 1589010.7695040002 | E84: 1413489.3853739593 | F84: 175521.38413004088 | K84: Alpac Forest Products Inc | L84: 16000 | M84: 16000 | N84: 0
A85: Grand Total | D85: 1589010.7695040002 | E85: 1413489.3853739593 | F85: 175521.38413004088 | K85: Bell Lumber & Pole | L85: 34770 | M85: 5000 | N85: 29770
K86: Forest City Trading Group | L86: 0 | M86: 0 | N86: 0
K87: Goldcorp Inc | L87: 392635 | M87: 350000 | N87: 42635
K88: Interfor | L88: 11659.5 | M88: 8000 | N88: 3659.5
K89: ITC Construction Group | L89: 14600 | M89: 10000 | N89: 4600
A90: Account Manager | B90: (All) | K90: Kal Tire | L90: 110705.09 | M90: 80000 | N90: 30705.089999999997
K91: NGRAIN Corporation | L91: 350 | N91: 350
A92: Revenue | B92: Market | C92: Actual | D92: Forecast | E92: Variance | K92: Pacific Blue Cross | L92: 167187 | M92: 160000 | N92: 7187
A93: Services | B93: Calgary | C93: 1955348.7295040002 | D93: 1777235 | E93: 178113.72950400016 | K93: Springer Creek Forest Products Ltd. | L93: 0 | M93: 0 | N93: 0
B94: Edmonton | C94: 844443.79 | D94: 792789.38537395932 | E94: 51654.404626040719 | K94: Stella-Jones Canada Inc | L94: 1710 | M94: 0 | N94: 1710
B95: Regina | C95: 144266.16 | D95: 142859 | E95: 1407.1600000000035 | K95: Tembec Industries Inc | L95: 1620 | M95: 0 | N95: 1620
B96: Vancouver | C96: 1604881.2 | D96: 1406500 | E96: 198381.19999999995 | K96: TimberWest Forest Corp. | L96: 3660 | M96: 2800 | N96: 860
B97: Victoria | C97: 2097706.6500000004 | D97: 1869550 | E97: 228156.65000000037 | K97: Tolko Industries Ltd | L97: 299466.25 | M97: 250000 | N97: 49466.25
B98: Winnipeg | C98: 900847.19000000006 | D98: 851513 | E98: 49334.190000000061 | K98: Vancouver International Airport Auth. | L98: 12540 | M98: 25000 | N98: -12460
A99: Services Total | C99: 7547493.7195040016 | D99: 6840446.3853739593 | E99: 707047.33413004037 | J99: Collins, Carol Total | L99: 1094696.1099999999 | M99: 934800 | N99: 159896.10999999987
A100: M&S | B100: Calgary | C100: 30437 | D100: 0 | E100: 30437 | J100: Fabi, Roger | K100: BC Automobile Association | L100: 9890 | M100: 17000 | N100: -7110
B101: Edmonton | C101: 0 | D101: 0 | E101: 0 | K101: Canadian Western Trust | L101: 14060 | M101: 28000 | N101: -13940
B102: Regina | C102: 300 | D102: 0 | E102: 300 | K102: Mountain Equipment Co-op | L102: 42840 | M102: 34600 | N102: 8240
B103: Vancouver | C103: 9836 | D103: 0 | E103: 9836 | J103: Fabi, Roger Total | L103: 66790 | M103: 79600 | N103: -12810
A104: M&S Total | C104: 40573 | D104: 0 | E104: 40573 | J104: Hayden, Carolyn | K104: Annex Consulting Group Inc. | L104: 13893.6 | M104: 12600 | N104: 1293.6000000000004
A105: Product | B105: Calgary | C105: 65758.77 | D105: 0 | E105: 65758.77 | K105: British Columbia Hydro | L105: 720 | M105: 0 | N105: 720
B106: Edmonton | C106: 29300 | E106: 29300 | K106: British Columbia Provincial Renal Agency | L106: 0 | M106: 0 | N106: 0
B107: Vancouver | C107: 0 | D107: 0 | E107: 0 | K107: College of Registered Nurses BC | L107: 0 | M107: 0 | N107: 0
B108: Victoria | C108: 0 | D108: 0 | E108: 0 | K108: College Registered Nurses British Colum | L108: 63976.54 | M108: 40000 | N108: 23976.54
A109: Product Total | C109: 95058.77 | D109: 0 | E109: 95058.77 | K109: First Nations Health Authority | L109: 0 | M109: 0 | N109: 0
A110: Grand Total | C110: 7683125.4895040011 | D110: 6840446.3853739593 | E110: 842679.10413003992 | K110: Health Authority | L110: 0 | M110: 0 | N110: 0
K111: Imperial Parking | L111: 0 | M111: 0 | N111: 0
K112: Industry Trade Authority | L112: 0 | M112: 0 | N112: 0
K113: Ministry of Health | L113: 0 | M113: 0 | N113: 0
K114: Prov Health Services Authority | L114: 0 | M114: 0 | N114: 0
K115: Providence Health Care LMC HIM | L115: 0 | M115: 0 | N115: 0
K116: TELUS - Pacific Autism Family Centre | L116: 0 | M116: 15000 | N116: -15000
K117: Telus Sourcing Solutions | L117: 45985.18 | M117: 45000 | N117: 985.18000000000029
K118: Vancouver Coastal Health | L118: 0 | M118: 0 | N118: 0
K119: WorkSafeBC | L119: 25889 | M119: 0 | N119: 25889
K120: Yukon Territorial Government | L120: 0 | M120: 0 | N120: 0
J121: Hayden, Carolyn Total | L121: 150464.32000000001 | M121: 112600 | N121: 37864.320000000007
J122: Hughes, Bev | K122: College of Physicians and Surgeons BC | L122: 52560 | M122: 35000 | N122: 17560
K123: Kool-IP | L123: 0 | M123: 0 | N123: 0
J124: Hughes, Bev Total | L124: 52560 | M124: 35000 | N124: 17560
J125: Hunter, Rick | K125: BC Housing | L125: 0 | M125: 0 | N125: 0
K126: British Columbia Liquor Distribution Branch (BCLDB) | L126: 35418.58 | M126: 41000 | N126: -5581.4199999999983
K127: City Surrey Richmond | L127: 0 | M127: 0 | N127: 0
K128: Credit Unions Vancity Blueshore | L128: 0 | M128: 0 | N128: 0
K129: Metro Vancouver | L129: 0 | M129: 0 | N129: 0
K130: MITACS Inc | L130: 14560 | M130: 10000 | N130: 4560
K131: Seaspan Ship Management Ltd | L131: 0 | M131: 0 | N131: 0
K132: Simon Fraser University | L132: 32419.690000000002 | M132: 40000 | N132: -7580.3099999999977
K133: University of British Columbia | L133: 119840 | M133: 111500 | N133: 8340
K134: Vancouver Board of Education | L134: 25335 | M134: 42000 | N134: -16665
J135: Hunter, Rick Total | L135: 227573.27000000002 | M135: 244500 | N135: -16926.729999999981
J136: McNeil, Graeme | K136: Aeroinfo Systems a Div of Boeing Canada | L136: 12797.5 | M136: 0 | N136: 12797.5
K137: Insurance Corp of British Columbia(ICBC) | L137: 0 | M137: 0 | N137: 0
J138: McNeil, Graeme Total | L138: 12797.5 | M138: 0 | N138: 12797.5
J139: Thomson, Dan | K139: Royal Canadian Mounted Police - E Divisi | L139: 0 | M139: 0 | N139: 0
J140: Thomson, Dan Total | L140: 0 | M140: 0 | N140: 0
I141: Vancouver Total | L141: 1604881.2 | M141: 1406500 | N141: 198381.19999999995
I142: Victoria | J142: Brisbane, Ross | K142: British Columbia Oil and Gas Commission | L142: 33050 | M142: 37000 | N142: -3950
K143: British Columbia Pension Corp | L143: 52487.5 | M143: 50000 | N143: 2487.5
K144: HP ADVANCED SOLUTIONS INC | L144: 101521.5 | M144: 105000 | N144: -3478.5
K145: HP Co Canada | L145: 0 | M145: 0 | N145: 0
K146: JEA PENSIONS | L146: 49960 | M146: 48000 | N146: 1960
J147: Brisbane, Ross Total | L147: 237019 | M147: 240000 | N147: -2981
J148: Fabi, Roger | K148: BC Ministry of Children and Family Dev | L148: 24480 | M148: 25000 | N148: -520
K149: BC Ministry of Tech, Innov, & Citz Serv | L149: 387350.36 | M149: 375000 | N149: 12350.359999999986
K150: British Columbia Ministry of Health | L150: 54127.23 | M150: 65000 | N150: -10872.769999999997
K151: Harmac Pacific | L151: 2834.54 | M151: 5000 | N151: -2165.46
K152: Telus Communications Company | L152: 0 | M152: 0 | N152: 0
K153: Unit4 Business Software Corporation | L153: 10153 | M153: 13500 | N153: -3347
J154: Fabi, Roger Total | L154: 478945.12999999995 | M154: 483500 | N154: -4554.8700000000536
J155: Hayden, Carolyn | K155: Telus Communications Company | L155: 11190 | N155: 11190
J156: Hayden, Carolyn Total | L156: 11190 | N156: 11190
J157: McNeil, Graeme | K157: BC Ministry of Tech, Innov, & Citz Serv | L157: 180338.25 | M157: 155400 | N157: 24938.25
K158: BC Ministry Transport & Infrastructure | L158: 7600 | N158: 7600
K159: British Columbia Assessment | L159: 19687.5 | M159: 17500 | N159: 2187.5
K160: British Columbia Ferry Services Inc | L160: 95357.95 | M160: 97250 | N160: -1892.0500000000029
K161: Leading Matters Consulting Inc | L161: 0 | M161: 0 | N161: 0
K162: Medplus Inc | L162: 40469.31 | M162: 31500 | N162: 8969.3099999999977
K163: Telus Sourcing Solutions | L163: 443096.83 | M163: 370000 | N163: 73096.830000000016
J164: McNeil, Graeme Total | L164: 786549.84000000008 | M164: 671650 | N164: 114899.84000000008
J165: Robinson, Charlie | K165: BC Ministry of Justice | L165: 579998.67999999993 | M165: 465900 | N165: 114098.67999999993
K166: E-COMM Emergency Comm for SW BC Inc. | L166: 0 | M166: 0 | N166: 0
K167: International Technology Integration Inc | L167: 4004 | M167: 4000 | N167: 4
K168: Justice Institute of British Columbia | L168: 0 | M168: 4500 | N168: -4500
J169: Robinson, Charlie Total | L169: 584002.67999999993 | M169: 474400 | N169: 109602.67999999993
I170: Victoria Total | L170: 2097706.65 | M170: 1869550 | N170: 228156.64999999991
I171: Winnipeg | J171: Kostelnyk, Janice | K171: Great-West Life Assurance Co | L171: 72920.25 | M171: 70989 | N171: 1931.25
K172: Investors Group | L172: 237806.5 | M172: 199856 | N172: 37950.5
K173: MTS Allstream Inc | L173: 139185 | M173: 119000 | N173: 20185
K174: Princess Auto | L174: 32671.25 | M174: 30500 | N174: 2171.25
K175: Wawanesa Mutual Insurance | L175: 77457.5 | M175: 75000 | N175: 2457.5
J176: Kostelnyk, Janice Total | L176: 560040.5 | M176: 495345 | N176: 64695.5
J177: Wildman, Tim | K177: City of Winnipeg | L177: 0 | M177: 0 | N177: 0
K178: Diagnostic Services of Manitoba | L178: 52625.770000000004 | M178: 44670 | N178: 7955.7700000000041
K179: Manitoba Family Services and Labour | L179: 17250 | M179: 8500 | N179: 8750
K180: Manitoba Housing and Renewal Corp | L180: 35019.5 | M180: 38840 | N180: -3820.5
K181: Manitoba Jobs and the Economy | L181: 0 | M181: 0 | N181: 0
K182: MB Justice | L182: 0 | M182: 0 | N182: 0
K183: RedMane Technology | L183: 13770 | M183: 14000 | N183: -230
K184: University of Manitoba | L184: 20044.53 | M184: 31500 | N184: -11455.470000000001
K185: Winnipeg Reg Health Authority | L185: 185436.25 | M185: 200533 | N185: -15096.75
K186: Workers Comp Board of Manitoba | L186: 16660.64 | M186: 18125 | N186: -1464.3600000000006
J187: Wildman, Tim Total | L187: 340806.69 | M187: 356168 | N187: -15361.309999999998
I188: Winnipeg Total | L188: 900847.19000000006 | M188: 851513 | N188: 49334.190000000061
H189: Services Total | L189: 7547493.7195040006 | M189: 6840446.3853739593 | N189: 707047.33413003944
H190: M&S | I190: Calgary | J190: Frandsen, Cory | K190: Astra Energy Canada Inc. | L190: 24544 | N190: 24544
K191: Plains Midstream Canada ULC | L191: 5893 | M191: 0 | N191: 5893
J192: Frandsen, Cory Total | L192: 30437 | M192: 0 | N192: 30437
I193: Calgary Total | L193: 30437 | M193: 0 | N193: 30437
I194: Edmonton | J194: Coward, Craig | K194: Alberta Culture and Tourism | L194: 0 | N194: 0
J195: Coward, Craig Total | L195: 0 | N195: 0
J196: Van Dorp, Abe | K196: Alberta Solicitor General | L196: 0 | M196: 0 | N196: 0
J197: Van Dorp, Abe Total | L197: 0 | M197: 0 | N197: 0
I198: Edmonton Total | L198: 0 | M198: 0 | N198: 0
I199: Regina | J199: Thomson, Dan | K199: Saskatchewan Justice | L199: 300 | M199: 0 | N199: 300
J200: Thomson, Dan Total | L200: 300 | M200: 0 | N200: 300
I201: Regina Total | L201: 300 | M201: 0 | N201: 300
I202: Vancouver | J202: Collins, Carol | K202: Alpac Forest Products Inc | L202: 0 | M202: 0 | N202: 0
K203: Bell Lumber & Pole | L203: 9836 | N203: 9836
K204: Goldcorp Inc | L204: 0 | N204: 0
K205: Interfor | L205: 0 | M205: 0 | N205: 0
K206: NGRAIN Corporation | L206: 0 | M206: 0 | N206: 0
K207: TimberWest Forest Corp. | L207: 0 | M207: 0 | N207: 0
J208: Collins, Carol Total | L208: 9836 | M208: 0 | N208: 9836
I209: Vancouver Total | L209: 9836 | M209: 0 | N209: 9836
H210: M&S Total | L210: 40573 | M210: 0 | N210: 40573
H211: Product | I211: Calgary | J211: Frandsen, Cory | K211: Plains Midstream Canada ULC | L211: 65758.77 | M211: 0 | N211: 65758.77
K212: TBD - WHITESPACE - AX Licenses | L212: 0 | M212: 0 | N212: 0
J213: Frandsen, Cory Total | L213: 65758.77 | M213: 0 | N213: 65758.77
I214: Calgary Total | L214: 65758.77 | M214: 0 | N214: 65758.77
I215: Edmonton | J215: Coward, Craig | K215: Alberta Culture and Tourism | L215: 29300 | N215: 29300
J216: Coward, Craig Total | L216: 29300 | N216: 29300
I217: Edmonton Total | L217: 29300 | N217: 29300
I218: Vancouver | J218: Collins, Carol | K218: Ainsworth Engineered | L218: 0 | M218: 0 | N218: 0
K219: Interfor | L219: 0 | M219: 0 | N219: 0
K220: TimberWest Forest Corp. | L220: 0 | M220: 0 | N220: 0
J221: Collins, Carol Total | L221: 0 | M221: 0 | N221: 0
I222: Vancouver Total | L222: 0 | M222: 0 | N222: 0
I223: Victoria | J223: Robinson, Charlie | K223: BC Ministry of Justice | L223: 0 | M223: 0 | N223: 0
J224: Robinson, Charlie Total | L224: 0 | M224: 0 | N224: 0
I225: Victoria Total | L225: 0 | M225: 0 | N225: 0
H226: Product Total | L226: 95058.77 | M226: 0 | N226: 95058.77
H227: Grand Total | L227: 7683125.4895040002 | M227: 6840446.3853739593 | N227: 842679.10413003899

Sheet: READ ME Instructions
A1: Sierra Systems Group, Inc.
A2: FY 2014/2015 Forecast Template (Rules and Instructions)
A4: The Revenue Analysis tab is your INPUT DATA TAB
B7: COLUMN "LABEL" | C7: COLUMN "TITLE" | D7: INSTRUCTIONS
B8: "INSERT ROW" MACRO BUTTON (ORANGE) | D8: Use this macro to insert a blank row when adding a new opportunity. Current active cell must be below title row and all related formulas will pre-populate automatically.
B9: "REFRESH PIVOTS" MACRO BUTTON (GREEN) | D9: Use this macro after you have completed your updates. ALL pivots will refresh automatically.
B10: Column A | C10: Revenue Type | D10: Automatically populated once the Insert Row macro button is used, however if the revenue is for PRODUCT/M&S, then you need to select "Product" and or "M&S" from the drop down list. Drop down selections include: Services Revenue, Product Revenue OR M&S
B11: Column B | C11: Service Type | D11: Select from drop down list. If you have selected Revenue Type of Services, the drop down selections for Service Type includes: Consulting Services OR Managed Services. If you have selected Revenue Type of Product or M&S, the only drop down item is Other
B12: Column C | C12: GM Unit | D12: Select from drop down list. Drop down selections include: Canada East, Canada West, and Sierra US
B13: Column D | C13: Market | D13: Select from drop down list. Drop down selections include Sierra's geographical markets for each GM Unit: Canada East Markets are Atlantic, Ottawa, and Toronto Canada West Markets are Calgary, Edmonton, Regina, Victoria, Vancouver, and Winnipeg Sierra US Markets are Northeast, Southeast, Midwest, TOLA, Northwest, and West
B14: Column E | C14: Industry | D14: Select from drop down list. For Sierra Canada, drop down selections include: Commerical, Health, Justice, Public Sector, Energy & Utilities For Sierra US, drop down selections include: Commerical, Justice, and Public Sector
B15: Column F | C15: Sales Leader | D15: Account/Opportunity Sales Leader Name: This should always be spelled out in the format of (Last Name, First Name) – no initials please.
B16: Column G | C16: Account Manager | D16: Acct Mgr Responsible for Forecast Update: This should always be spelled out in the format of (Last Name, First Name) – no initials please.
B17: Column H | C17: Client Status | D17: Select from drop down list. Drop down selections include: Existing or New. New is for Clients that we have NEVER done business with before.
B18: Column I | C18: Client Name | D18: Client Name should be spelled out fully “as set in SalesForce & PS” - no abbreviations - be consistent and avoid multi-client name formats/duplications.
B19: Column J | C19: Opportunity Name & Description | D19: Provide opportunity and project description
B20: Column K | C20: PS Contract Activity #, or SalesForce Opp ID # | D20: Sierra Contract # and/or SalesForce Pipeline Opportunity # (DO NOT LEAVE BLANK)
B23: Column L | C23: Product / Platform | D23: Select from drop down list. Table below provides new selections
B24: Column M | C24: Primary Service Offering - Core Service | D24: Select from drop down list. Table below provides new selections
B25: Column N | C25: Specialized Solution
B27: Column O | C27: Probability Weighting % | D27: Select from drop down list. Table below provides examples of status determinants for consideration when assigning a weighting to the opportunity. These examples are not all inclusive nor are they the sole determinants of the ultimate weighting. A variety of factors should be considered before the leader ultimately applies his/her judgment in selecting a weighting.
B28: Columns P through to AM | D28: Input Monthly RAW Revenue Targets (per account and per opportunity) - Multi Year Workbook (FY2012 and FY2013)
B29: Columns AN through to CE | D29: Automatically Calculated - do not delete formulas Fomulas will be pre-populated automatically when "Insert Row" macro is used
B30: Columns CO & CQ | D30: DO NOT CHANGE OR DELETE: FOR INTERNAL FINANCE USE ONLY - Used for monthly Actual vs. Forecast Variance Analysis
B33: Product/Platform "Column L" | C33: Primary Service Offerings "Column M" | D33: Responsibilities Reminder: • GM Leader o Accountability for the overall business unit forecast. o Ongoing communication of material changes and issues to Senior Management / Finance. • Sales Leader o Ownership & accountability for the overall business unit forecast and the underlying data. o Work with Delivery and Account Managers to capture, quantify and validate all pipeline opportunities ensuring accurate and timely forecast updates are submitted. • Delivery & Account Managers o Work with Sales Leader to capture, quantify and validate all pipeline opportunities ensuring accurate and timely forecast updates are submitted. • Finance (Revenue Forecasting) o Consolidate and provide reporting to all Stakeholders. o Engaged as needed to provide support & assistance to GM’s and Sales Leaders. o Manage the Revenue Forecasting Process. o Validate, modify and communicate consistent set of forecast rules/parameters and incorporate actual monthly revenues from back office systems to run financial analysis as needed. When forecasting for unidentified account or opportunities, please use the following naming convention: • If an opportunity is considered a plug, whitespace or TBD, please prefix the description using the word “TBD”. I have gone ahead and made some changes where applicable, but please review carefully to ensure that I have captured your TBD’s correctly. Examples include: 1. TBD-Unknown Account, TBD-Account Name, etc…. 2. TBD-Plug, TBD-Whitespace. TBD-Staff Aug, etc….
B34: For Canada East and Canada West: | C34: For Canada East and Canada West:
B35: Business Intelligence (BI) | C35: Business Intelligence (BI)
B36: Custom Development (CD) | C36: Collaboration / ECM
B37: e-Business Suite (EBS) | C37: Custom Development (CD)
B38: Infor | C38: Enterprise Application (EA)
B39: Mgmt Consulting (MC) | C39: Management Consulting (MC)
B40: MS Dynamics | C40: MS (Other)
B41: MS SharePoint | C41: SI (Other)
B42: PeopleSoft (PS) | C42: For Sierra US:
B43: SI (Other) | C43: Business Intelligence (BI)
B44: For Sierra US: | C44: Custom Development (CD)
B45: Business Intelligence (BI) | C45: Enterprise Application (EA)
B46: e-Business Suite (EBS) | C46: MS (Other)
B47: Infor | C47: SI (Other)
B48: PeopleSoft (PS)
B49: SI (Other)
B51: Specialized Solution "Column N"
B52: Align
B53: Axios
B54: Curam
B55: Engage
B56: HLTH-Business Systems (BUS)
B57: HLTH-Chronic Disease Management (CDM)
B58: HLTH-Clinical Information Systems (CIS)
B59: HLTH-Consumer Health
B60: HLTH-Electronic Health Records (EHR)
B61: HLTH-Other
B62: HLTH-Primary Care
B63: HLTH-Public Health & Surveillance (PUB)
B64: HLTH-Registries (REG)
B65: Identity Management Solutions | C65: WEIGHTING % "Column O" | D65: DETERMINANT DEFINITIONS
B66: ITSM | C66: 0 | D66: Oppt'y identified with no weighting
B67: JPS - Early Intervention Systems | C67: 0.1 | D67: Oppt'y identified, client commitment, proposal being developed
B68: JPS - Integrated Justice | C68: 0.3 | D68: Proposal submitted, clarifying questions communicated to Sierra
B69: JPS -Court Case Management | C69: 0.5 | D69: Orals scheduled, Sierra short-listed, initial contract discussions
B70: Lead | C70: 0.75 | D70: Finalist
B71: Manatron | C71: 0.9 | D71: Closing/Verbal Commitment
B72: Microsoft Platform | C72: 1 | D72: Won/Contract signed by all parties
B73: Oracle Platform
B74: Other
B75: Perform
B76: Softcode
B77: Software AG
B78: Tyler

Sheet: Frcst vs. Plan-By Market
A1: Consulting Services | B1: Market | C1: Oct-14 WT | D1: Nov-14 WT | E1: Dec-14 WT | F1: Jan-15 WT | G1: Feb-15 WT | H1: Mar-15 WT | I1: Apr-15 WT | J1: May-15 WT | K1: Jun-15 WT | L1: Jul-15 WT | M1: Aug-15 WT | N1: Sept-15 WT | O1: Total FY15 Plan
B2: Calgary | C2: 1126860 | D2: 1319976.0904383806 | E2: 1035446.0935272161 | F2: 1196637.7808277302 | G2: 1012040.7473689797 | H2: 1358013.8400897468 | I2: 1367658.2608080404 | J2: 1291802.2563971449 | K2: 1327735.9179104562 | L2: 1330911.8136726343 | M2: 1280278.6390937374 | N2: 1368660.5698659392 | O2: =SUM(RC[-12]:RC[-1]) -> 15016022.010000005
B3: Edmonton | C3: 420241.5 | D3: 852837.42571366276 | E3: 765540.84920388204 | F3: 829361.82113595097 | G3: 791215.24065127596 | H3: 1147425.726856248 | I3: 590348.51946093154 | J3: 693079.64504967141 | K3: 688327.45398254227 | L3: 509422.76587957947 | M3: 558008.0754751421 | N3: 615569.706591113 | O3: =SUM(RC[-12]:RC[-1]) -> 8461378.7300000004
B4: Regina | C4: 137702.75 | D4: 153088.7272379091 | E4: 114082.27730240667 | F4: 132635.92656230062 | G4: 106255.34026087905 | H4: 145997.56052259996 | I4: 165443.69758656807 | J4: 154284.42986854678 | K4: 151842.85031134289 | L4: 176078.48749038717 | M4: 105204.08812177862 | N4: 133922.62473528113 | O4: =SUM(RC[-12]:RC[-1]) -> 1676538.76
B5: Vancouver | C5: 1587993.6000000001 | D5: 1738394.6308718482 | E5: 1595264.0031319601 | F5: 1901217.1858425399 | G5: 1747991.6181231737 | H5: 1880066.8318481836 | I5: 2052506.3198399628 | J5: 2103785.0370703838 | K5: 1973566.2823722279 | L5: 1802652.9975271069 | M5: 1613636.6220350629 | N5: 1761824.9513375498 | O5: =SUM(RC[-12]:RC[-1]) -> 21758900.080000002
B6: Victoria | C6: 1950550 | D6: 1974981.2301290578 | E6: 1281479.6243789543 | F6: 2373676.2796735028 | G6: 2200154.6811583415 | H6: 2409554.6801186865 | I6: 2259279.9730364215 | J6: 2182996.2705559824 | K6: 1684569.5618347484 | L6: 1950089.8058644 | M6: 1873930.3161882896 | N6: 1824947.5770616175 | O6: =SUM(RC[-12]:RC[-1]) -> 23966210.000000004
B7: Winnipeg | C7: 1014604 | D7: 803389.07909172238 | E7: 701203.5001180002 | F7: 824672.94045129302 | G7: 779830.64977557876 | H7: 897112.36796615121 | I7: 987952.54522061546 | J7: 990601.14784758468 | K7: 958679.90434733755 | L7: 978561.12929447333 | M7: 830948.68874088954 | N7: 1016444.9571463538 | O7: =SUM(RC[-12]:RC[-1]) -> 10784000.91
C8: =SUM(R[-6]C:R[-1]C) -> 6237951.8499999996 | D8: =SUM(R[-6]C:R[-1]C) -> 6842667.1834825808 | E8: =SUM(R[-6]C:R[-1]C) -> 5493016.34766242 | F8: =SUM(R[-6]C:R[-1]C) -> 7258201.9344933173 | G8: =SUM(R[-6]C:R[-1]C) -> 6637488.2773382282 | H8: =SUM(R[-6]C:R[-1]C) -> 7838171.0074016163 | I8: =SUM(R[-6]C:R[-1]C) -> 7423189.3159525394 | J8: =SUM(R[-6]C:R[-1]C) -> 7416548.7867893139 | K8: =SUM(R[-6]C:R[-1]C) -> 6784721.970758656 | L8: =SUM(R[-6]C:R[-1]C) -> 6747716.9997285819 | M8: =SUM(R[-6]C:R[-1]C) -> 6262006.4296549 | N8: =SUM(R[-6]C:R[-1]C) -> 6721370.3867378552 | O8: =SUM(R[-6]C:R[-1]C) -> 81663050.49000001
A10: Managed Services | B10: Market | C10: Oct-14 WT | D10: Nov-14 WT | E10: Dec-14 WT | F10: Jan-15 WT | G10: Feb-15 WT | H10: Mar-15 WT | I10: Apr-15 WT | J10: May-15 WT | K10: Jun-15 WT | L10: Jul-15 WT | M10: Aug-15 WT | N10: Sept-15 WT | O10: Total FY15 Plan
B11: Calgary | C11: 752725 | D11: 885246.83653873438 | E11: 796305.67844724981 | F11: 942722.9658700726 | G11: 803089.60152990627 | H11: 865925.42247445171 | I11: 908207.85651155363 | J11: 905739.07461292238 | K11: 819531.57118779467 | L11: 808406.4216979401 | M11: 730099.53529660706 | N11: 766544.73583276628 | O11: =SUM(RC[-12]:RC[-1]) -> 9984544.6999999993
B12: Edmonton | C12: 659038.83161175158 | D12: 699830.46768192761 | E12: 598622.88266401773 | F12: 836471.52654197533 | G12: 671651.46395653638 | H12: 1083298.0959284315 | I12: 741430.61241543468 | J12: 736427.9665515793 | K12: 600761.65230162803 | L12: 691408.60587375285 | M12: 912161.756359622 | N12: 615278.18811334169 | O12: =SUM(RC[-12]:RC[-1]) -> 8846382.0499999989
B13: Regina | C13: 14000 | D13: 18870.532214606115 | E13: 15917.254809757102 | F13: 16312.19395341446 | G13: 14018.686379675286 | H13: 15434.653940287944 | I13: 15610.208080663675 | J13: 14416.624477110418 | K13: 15045.02063792972 | L13: 16540.575818029407 | M13: 13910.031977419083 | N13: 7424.2177111067904 | O13: =SUM(RC[-12]:RC[-1]) -> 177500
B14: Vancouver | C14: 113300 | D14: 94359.919499308962 | E14: 92079.916594060051 | F14: 107827.66843535953 | G14: 99498.676095073024 | H14: 109037.13846764195 | I14: 83592.019346570509 | J14: 74605.939868608169 | K14: 76427.277501211502 | L14: 103022.12908217467 | M14: 118258.29675915747 | N14: 169091.0383508341 | O14: =SUM(RC[-12]:RC[-1]) -> 1241100.02
B15: Victoria | C15: 249500 | D15: 282267.88895584026 | E15: 235219.35311507405 | F15: 351677.47256332258 | G15: 318558.45341331034 | H15: 418123.42387679534 | I15: 226419.39307764807 | J15: 352683.25203007553 | K15: 314235.11186026398 | L15: 318450.28031146753 | M15: 303341.29002521036 | N15: 264814.08077099215 | O15: =SUM(RC[-12]:RC[-1]) -> 3635290.0000000005
B16: Winnipeg | C16: 0 | D16: 0 | E16: 0 | F16: 0 | G16: 0 | H16: 0 | I16: 0 | J16: 0 | K16: 0 | L16: 0 | M16: 0 | N16: 0 | O16: =SUM(RC[-12]:RC[-1]) -> 0
C17: =SUM(R[-6]C:R[-1]C) -> 1788563.8316117516 | D17: =SUM(R[-6]C:R[-1]C) -> 1980575.6448904173 | E17: =SUM(R[-6]C:R[-1]C) -> 1738145.0856301589 | F17: =SUM(R[-6]C:R[-1]C) -> 2255011.8273641444 | G17: =SUM(R[-6]C:R[-1]C) -> 1906816.8813745016 | H17: =SUM(R[-6]C:R[-1]C) -> 2491818.7346876087 | I17: =SUM(R[-6]C:R[-1]C) -> 1975260.0894318705 | J17: =SUM(R[-6]C:R[-1]C) -> 2083872.8575402957 | K17: =SUM(R[-6]C:R[-1]C) -> 1826000.6334888279 | L17: =SUM(R[-6]C:R[-1]C) -> 1937828.0127833649 | M17: =SUM(R[-6]C:R[-1]C) -> 2077770.9104180159 | N17: =SUM(R[-6]C:R[-1]C) -> 1823152.2607790411 | O17: =SUM(R[-6]C:R[-1]C) -> 23884816.77
A19: CANADA WEST TOTAL | C19: =R[-2]C+R[-11]C -> 8026515.6816117512 | D19: =R[-2]C+R[-11]C -> 8823242.8283729982 | E19: =R[-2]C+R[-11]C -> 7231161.4332925789 | F19: =R[-2]C+R[-11]C -> 9513213.7618574612 | G19: =R[-2]C+R[-11]C -> 8544305.1587127298 | H19: =R[-2]C+R[-11]C -> 10329989.742089225 | I19: =R[-2]C+R[-11]C -> 9398449.4053844102 | J19: =R[-2]C+R[-11]C -> 9500421.6443296093 | K19: =R[-2]C+R[-11]C -> 8610722.6042474844 | L19: =R[-2]C+R[-11]C -> 8685545.0125119463 | M19: =R[-2]C+R[-11]C -> 8339777.3400729159 | N19: =R[-2]C+R[-11]C -> 8544522.6475168969 | O19: =R[-2]C+R[-11]C -> 105547867.26000001
A22: Revenue Type | B22: Services
A23: Probability Weights | B23: (All) | C23: TOTAL FORECAST, FILTER on 100% probability to get SOLD $
A25: Service Type | B25: Market | C25: Oct-14 WT | D25: Nov-14 WT | E25: Dec-14 WT | F25: Jan-15 WT | G25: Feb-15 WT | H25: Mar-15 WT | I25: Apr-15 WT | J25: May-15 WT | K25: Jun-15 WT | L25: Jul-15 WT | M25: Aug-15 WT | N25: Sep-15 WT | O25: Total FY15 WT
A26: Consulting Services | B26: Calgary | C26: 1224217.97 | D26: 1146383.1400000001 | E26: 1116190.6600000001 | F26: 1265991.31 | G26: 1233172.25 | H26: 1195479.125 | I26: 964259.5 | J26: 697274.75 | K26: 606242.5 | L26: 590742.5 | M26: 595842.5 | N26: 604092.5 | O26: 11239888.705
B27: Edmonton | C27: 352995.68 | D27: 730675.99 | E27: 290541.25 | F27: 291565.88 | G27: 239197.5 | H27: 364273.75 | I27: 139588.72999999998 | J27: 102511.6 | K27: 94054.05 | L27: 86976.15 | M27: 74761.600000000006 | N27: 86501.725000000006 | O27: 2853643.9050000003
B28: Regina | C28: 140361.44 | D28: 119124.83 | E28: 131454.27000000002 | F28: 131498.16 | G28: 122900.625 | H28: 145446.75 | I28: 185377.22500000001 | J28: 182295 | K28: 172849.95 | L28: 163368.22500000001 | M28: 143943.75 | N28: 147042.03750000001 | O28: 1785662.2625000002
B29: Vancouver | C29: 1843809.22 | D29: 1598973.48 | E29: 1435805 | F29: 1462326.6099999999 | G29: 1182192.5 | H29: 1655892.5 | I29: 1444892.5 | J29: 1371392.5 | K29: 1439992.5 | L29: 1326242.5 | M29: 1263742.5 | N29: 1434042.5 | O29: 17459304.310000002
B30: Victoria | C30: 1930930.7199999997 | D30: 1777971.69 | E30: 1683957.1999999997 | F30: 1906253.8 | G30: 2326850 | H30: 2145450 | I30: 1100900 | J30: 1136400 | K30: 1260460 | L30: 1260950 | M30: 1216400 | N30: 1222300 | O30: 18968823.41
B31: Winnipeg | C31: 1135959.2 | D31: 927227.26 | E31: 862225.99 | F31: 900847.19000000006 | G31: 792126 | H31: 868478 | I31: 874936 | J31: 813621 | K31: 851857.5 | L31: 759342.5 | M31: 713407.7 | N31: 754133.7 | O31: 10254162.040000001
A32: Grand Total | C32: 6628274.2299999995 | D32: 6300356.3900000006 | E32: 5520174.3700000001 | F32: 5958482.9500000002 | G32: 5896438.875 | H32: 6375020.125 | I32: 4709953.9550000001 | J32: 4303494.8499999996 | K32: 4425456.5 | L32: 4187621.875 | M32: 4008098.05 | N32: 4248112.4625000004 | O32: 62561484.6325
A35: Revenue Type | B35: Services
A36: Probability Weights | B36: (All) | C36: TOTAL FORECAST, FILTER on 100% probability to get SOLD $
A38: Service Type | B38: Market | C38: Oct-14 WT | D38: Nov-14 WT | E38: Dec-14 WT | F38: Jan-15 WT | G38: Feb-15 WT | H38: Mar-15 WT | I38: Apr-15 WT | J38: May-15 WT | K38: Jun-15 WT | L38: Jul-15 WT | M38: Aug-15 WT | N38: Sep-15 WT | O38: Total FY15 WT
A39: Managed Services | B39: Calgary | C39: 792164.77360199997 | D39: 669377.73144700006 | E39: 614523.70808000001 | F39: 689357.41950399999 | G39: 646170.44999999995 | H39: 657058.67500000005 | I39: 647159.19999999995 | J39: 687005.6 | K39: 729155 | L39: 724317.25 | M39: 708929.5 | N39: 721705 | O39: 8286924.3076330014
B40: Edmonton | C40: 719913.48 | D40: 541574.74 | E40: 497479.51999999996 | F40: 552877.90999999992 | G40: 707560.09320014156 | H40: 552280.22901204508 | I40: 414573.29377191328 | J40: 378557.50916973595 | K40: 366776.48782848194 | L40: 337832.59291689284 | M40: 492656.95578394993 | N40: 353600.67062250804 | O40: 5915683.4823056692
B41: Regina | C41: 14784 | D41: 12768 | E41: 9408 | F41: 12768 | G41: 14000 | H41: 14000 | I41: 7250 | J41: 7250 | K41: 7250 | L41: 7250 | M41: 7250 | N41: 7250 | O41: 121228
B42: Vancouver | C42: 197080.9 | D42: 129310.95999999999 | E42: 126776 | F42: 142554.59 | G42: 96800 | H42: 106800 | I42: 115550 | J42: 205550 | K42: 114550 | L42: 129550 | M42: 113550 | N42: 113550 | O42: 1591622.45
B43: Victoria | C43: 241501.45 | D43: 229666.21 | E43: 226926.78000000003 | F43: 191452.85 | G43: 150000 | H43: 144600 | I43: 140000 | J43: 166500 | K43: 153000 | L43: 153000 | M43: 153000 | N43: 162000 | O43: 2111647.29
A44: Grand Total | C44: 1965444.6036019998 | D44: 1582697.641447 | E44: 1475114.0080800001 | F44: 1589010.7695040002 | G44: 1614530.5432001415 | H44: 1474738.9040120451 | I44: 1324532.4937719132 | J44: 1444863.109169736 | K44: 1370731.4878284819 | L44: 1351949.8429168928 | M44: 1475386.4557839499 | N44: 1358105.670622508 | O44: 18027105.529938668
A46: CANADA WEST TOTAL | C46: =R[-14]C+R[-2]C -> 8593718.833602 | D46: =R[-14]C+R[-2]C -> 7883054.0314470008 | E46: =R[-14]C+R[-2]C -> 6995288.3780800002 | F46: =R[-14]C+R[-2]C -> 7547493.7195040006 | G46: =R[-14]C+R[-2]C -> 7510969.4182001418 | H46: =R[-14]C+R[-2]C -> 7849759.0290120449 | I46: =R[-14]C+R[-2]C -> 6034486.4487719135 | J46: =R[-14]C+R[-2]C -> 5748357.9591697361 | K46: =R[-14]C+R[-2]C -> 5796187.9878284819 | L46: =R[-14]C+R[-2]C -> 5539571.7179168928 | M46: =R[-14]C+R[-2]C -> 5483484.50578395 | N46: =R[-14]C+R[-2]C -> 5606218.1331225084 | O46: =R[-14]C+R[-2]C -> 80588590.162438661
A49: Frcst vs. Plan - Consulting Services | B49: Market | C49: Oct-14 WT | D49: Nov-14 WT | E49: Dec-14 WT | F49: Jan-15 WT | G49: Feb-15 WT | H49: Mar-15 WT | I49: Apr-15 WT | J49: May-15 WT | K49: Jun-15 WT | L49: Jul-15 WT | M49: Aug-15 WT | N49: Sept-15 WT | O49: Total FY15 Plan
B50: Calgary | C50: =R[-24]C-R[-48]C -> 97357.969999999972 | D50: =R[-24]C-R[-48]C -> -173592.95043838047 | E50: =R[-24]C-R[-48]C -> 80744.566472784034 | F50: =R[-24]C-R[-48]C -> 69353.52917226986 | G50: =R[-24]C-R[-48]C -> 221131.50263102027 | H50: =R[-24]C-R[-48]C -> -162534.71508974675 | I50: =R[-24]C-R[-48]C -> -403398.76080804039 | J50: =R[-24]C-R[-48]C -> -594527.50639714487 | K50: =R[-24]C-R[-48]C -> -721493.41791045619 | L50: =R[-24]C-R[-48]C -> -740169.31367263431 | M50: =R[-24]C-R[-48]C -> -684436.13909373735 | N50: =R[-24]C-R[-48]C -> -764568.06986593921 | O50: =SUM(RC[-12]:RC[-1]) -> -3776133.3050000053
B51: Edmonton | C51: =R[-24]C-R[-48]C -> -67245.820000000007 | D51: =R[-24]C-R[-48]C -> -122161.43571366277 | E51: =R[-24]C-R[-48]C -> -474999.59920388204 | F51: =R[-24]C-R[-48]C -> -537795.94113595097 | G51: =R[-24]C-R[-48]C -> -552017.74065127596 | H51: =R[-24]C-R[-48]C -> -783151.97685624799 | I51: =R[-24]C-R[-48]C -> -450759.78946093156 | J51: =R[-24]C-R[-48]C -> -590568.04504967143 | K51: =R[-24]C-R[-48]C -> -594273.40398254222 | L51: =R[-24]C-R[-48]C -> -422446.61587957945 | M51: =R[-24]C-R[-48]C -> -483246.47547514213 | N51: =R[-24]C-R[-48]C -> -529067.98159111303 | O51: =SUM(RC[-12]:RC[-1]) -> -5607734.8249999993
B52: Regina | C52: =R[-24]C-R[-48]C -> 2658.6900000000023 | D52: =R[-24]C-R[-48]C -> -33963.897237909099 | E52: =R[-24]C-R[-48]C -> 17371.992697593349 | F52: =R[-24]C-R[-48]C -> -1137.7665623006178 | G52: =R[-24]C-R[-48]C -> 16645.284739120951 | H52: =R[-24]C-R[-48]C -> -550.81052259996068 | I52: =R[-24]C-R[-48]C -> 19933.527413431933 | J52: =R[-24]C-R[-48]C -> 28010.57013145322 | K52: =R[-24]C-R[-48]C -> 21007.099688657123 | L52: =R[-24]C-R[-48]C -> -12710.262490387162 | M52: =R[-24]C-R[-48]C -> 38739.661878221377 | N52: =R[-24]C-R[-48]C -> 13119.412764718872 | O52: =SUM(RC[-12]:RC[-1]) -> 109123.50249999999
B53: Vancouver | C53: =R[-24]C-R[-48]C -> 255815.61999999988 | D53: =R[-24]C-R[-48]C -> -139421.15087184822 | E53: =R[-24]C-R[-48]C -> -159459.00313196005 | F53: =R[-24]C-R[-48]C -> -438890.57584254001 | G53: =R[-24]C-R[-48]C -> -565799.11812317371 | H53: =R[-24]C-R[-48]C -> -224174.33184818365 | I53: =R[-24]C-R[-48]C -> -607613.81983996276 | J53: =R[-24]C-R[-48]C -> -732392.53707038378 | K53: =R[-24]C-R[-48]C -> -533573.78237222787 | L53: =R[-24]C-R[-48]C -> -476410.4975271069 | M53: =R[-24]C-R[-48]C -> -349894.12203506287 | N53: =R[-24]C-R[-48]C -> -327782.45133754984 | O53: =SUM(RC[-12]:RC[-1]) -> -4299595.7699999996
B54: Victoria | C54: =R[-24]C-R[-48]C -> -19619.280000000261 | D54: =R[-24]C-R[-48]C -> -197009.54012905783 | E54: =R[-24]C-R[-48]C -> 402477.57562104543 | F54: =R[-24]C-R[-48]C -> -467422.47967350273 | G54: =R[-24]C-R[-48]C -> 126695.31884165853 | H54: =R[-24]C-R[-48]C -> -264104.68011868652 | I54: =R[-24]C-R[-48]C -> -1158379.9730364215 | J54: =R[-24]C-R[-48]C -> -1046596.2705559824 | K54: =R[-24]C-R[-48]C -> -424109.56183474837 | L54: =R[-24]C-R[-48]C -> -689139.8058644 | M54: =R[-24]C-R[-48]C -> -657530.31618828955 | N54: =R[-24]C-R[-48]C -> -602647.57706161751 | O54: =SUM(RC[-12]:RC[-1]) -> -4997386.5900000026
B55: Winnipeg | C55: =R[-24]C-R[-48]C -> 121355.19999999995 | D55: =R[-24]C-R[-48]C -> 123838.18090827763 | E55: =R[-24]C-R[-48]C -> 161022.48988199979 | F55: =R[-24]C-R[-48]C -> 76174.249548707041 | G55: =R[-24]C-R[-48]C -> 12295.350224421243 | H55: =R[-24]C-R[-48]C -> -28634.367966151214 | I55: =R[-24]C-R[-48]C -> -113016.54522061546 | J55: =R[-24]C-R[-48]C -> -176980.14784758468 | K55: =R[-24]C-R[-48]C -> -106822.40434733755 | L55: =R[-24]C-R[-48]C -> -219218.62929447333 | M55: =R[-24]C-R[-48]C -> -117540.98874088959 | N55: =R[-24]C-R[-48]C -> -262311.25714635383 | O55: =SUM(RC[-12]:RC[-1]) -> -529838.87
C56: =SUM(R[-6]C:R[-1]C) -> 390322.37999999954 | D56: =SUM(R[-6]C:R[-1]C) -> -542310.79348258069 | E56: =SUM(R[-6]C:R[-1]C) -> 27158.022337580565 | F56: =SUM(R[-6]C:R[-1]C) -> -1299718.9844933175 | G56: =SUM(R[-6]C:R[-1]C) -> -741049.40233822865 | H56: =SUM(R[-6]C:R[-1]C) -> -1463150.8824016163 | I56: =SUM(R[-6]C:R[-1]C) -> -2713235.3609525394 | J56: =SUM(R[-6]C:R[-1]C) -> -3113053.9367893143 | K56: =SUM(R[-6]C:R[-1]C) -> -2359265.4707586551 | L56: =SUM(R[-6]C:R[-1]C) -> -2560095.1247285809 | M56: =SUM(R[-6]C:R[-1]C) -> -2253908.3796549002 | N56: =SUM(R[-6]C:R[-1]C) -> -2473257.9242378548 | O56: =SUM(R[-6]C:R[-1]C) -> -19101565.857500009
A58: Frcst vs. Plan - Managed Services | B58: Market | C58: Oct-14 WT | D58: Nov-14 WT | E58: Dec-14 WT | F58: Jan-15 WT | G58: Feb-15 WT | H58: Mar-15 WT | I58: Apr-15 WT | J58: May-15 WT | K58: Jun-15 WT | L58: Jul-15 WT | M58: Aug-15 WT | N58: Sept-15 WT | O58: Total FY15 Plan
B59: Calgary | C59: =R[-20]C-R[-48]C -> 39439.773601999972 | D59: =R[-20]C-R[-48]C -> -215869.10509173432 | E59: =R[-20]C-R[-48]C -> -181781.9703672498 | F59: =R[-20]C-R[-48]C -> -253365.54636607261 | G59: =R[-20]C-R[-48]C -> -156919.15152990632 | H59: =R[-20]C-R[-48]C -> -208866.74747445167 | I59: =R[-20]C-R[-48]C -> -261048.65651155368 | J59: =R[-20]C-R[-48]C -> -218733.47461292241 | K59: =R[-20]C-R[-48]C -> -90376.571187794674 | L59: =R[-20]C-R[-48]C -> -84089.171697940095 | M59: =R[-20]C-R[-48]C -> -21170.035296607064 | N59: =R[-20]C-R[-48]C -> -44839.735832766281 | O59: =SUM(RC[-12]:RC[-1]) -> -1697620.3923669993
B60: Edmonton | C60: =R[-20]C-R[-48]C -> 60874.648388248403 | D60: =R[-20]C-R[-48]C -> -158255.72768192762 | E60: =R[-20]C-R[-48]C -> -101143.36266401777 | F60: =R[-20]C-R[-48]C -> -283593.61654197541 | G60: =R[-20]C-R[-48]C -> 35908.629243605188 | H60: =R[-20]C-R[-48]C -> -531017.86691638641 | I60: =R[-20]C-R[-48]C -> -326857.3186435214 | J60: =R[-20]C-R[-48]C -> -357870.45738184336 | K60: =R[-20]C-R[-48]C -> -233985.16447314608 | L60: =R[-20]C-R[-48]C -> -353576.01295686001 | M60: =R[-20]C-R[-48]C -> -419504.80057567207 | N60: =R[-20]C-R[-48]C -> -261677.51749083365 | O60: =SUM(RC[-12]:RC[-1]) -> -2930698.5676943301
B61: Regina | C61: =R[-20]C-R[-48]C -> 784 | D61: =R[-20]C-R[-48]C -> -6102.5322146061153 | E61: =R[-20]C-R[-48]C -> -6509.2548097571016 | F61: =R[-20]C-R[-48]C -> -3544.1939534144603 | G61: =R[-20]C-R[-48]C -> -18.686379675285934 | H61: =R[-20]C-R[-48]C -> -1434.6539402879444 | I61: =R[-20]C-R[-48]C -> -8360.208080663675 | J61: =R[-20]C-R[-48]C -> -7166.6244771104175 | K61: =R[-20]C-R[-48]C -> -7795.0206379297197 | L61: =R[-20]C-R[-48]C -> -9290.5758180294069 | M61: =R[-20]C-R[-48]C -> -6660.031977419083 | N61: =R[-20]C-R[-48]C -> -174.21771110679038 | O61: =SUM(RC[-12]:RC[-1]) -> -56272
B62: Vancouver | C62: =R[-20]C-R[-48]C -> 83780.899999999994 | D62: =R[-20]C-R[-48]C -> 34951.04050069103 | E62: =R[-20]C-R[-48]C -> 34696.083405939949 | F62: =R[-20]C-R[-48]C -> 34726.921564640463 | G62: =R[-20]C-R[-48]C -> -2698.676095073024 | H62: =R[-20]C-R[-48]C -> -2237.1384676419548 | I62: =R[-20]C-R[-48]C -> 31957.980653429491 | J62: =R[-20]C-R[-48]C -> 130944.06013139183 | K62: =R[-20]C-R[-48]C -> 38122.722498788498 | L62: =R[-20]C-R[-48]C -> 26527.870917825334 | M62: =R[-20]C-R[-48]C -> -4708.2967591574707 | N62: =R[-20]C-R[-48]C -> -55541.038350834104 | O62: =SUM(RC[-12]:RC[-1]) -> 350522.43
B63: Victoria | C63: =R[-20]C-R[-48]C -> -7998.5499999999884 | D63: =R[-20]C-R[-48]C -> -52601.678955840267 | E63: =R[-20]C-R[-48]C -> -8292.5731150740176 | F63: =R[-20]C-R[-48]C -> -160224.62256332257 | G63: =R[-20]C-R[-48]C -> -168558.45341331034 | H63: =R[-20]C-R[-48]C -> -273523.42387679534 | I63: =R[-20]C-R[-48]C -> -86419.39307764807 | J63: =R[-20]C-R[-48]C -> -186183.25203007553 | K63: =R[-20]C-R[-48]C -> -161235.11186026398 | L63: =R[-20]C-R[-48]C -> -165450.28031146753 | M63: =R[-20]C-R[-48]C -> -150341.29002521036 | N63: =R[-20]C-R[-48]C -> -102814.08077099215 | O63: =SUM(RC[-12]:RC[-1]) -> -1523642.7100000004
B64: Winnipeg | O64: =SUM(RC[-12]:RC[-1]) -> 0
C65: =SUM(R[-6]C:R[-1]C) -> 176880.77199024838 | D65: =SUM(R[-6]C:R[-1]C) -> -397878.00344341726 | E65: =SUM(R[-6]C:R[-1]C) -> -263031.07755015872 | F65: =SUM(R[-6]C:R[-1]C) -> -666001.05786014453 | G65: =SUM(R[-6]C:R[-1]C) -> -292286.33817435976 | H65: =SUM(R[-6]C:R[-1]C) -> -1017079.8306755634 | I65: =SUM(R[-6]C:R[-1]C) -> -650727.59565995727 | J65: =SUM(R[-6]C:R[-1]C) -> -639009.74837055989 | K65: =SUM(R[-6]C:R[-1]C) -> -455269.14566034597 | L65: =SUM(R[-6]C:R[-1]C) -> -585878.16986647178 | M65: =SUM(R[-6]C:R[-1]C) -> -602384.45463406609 | N65: =SUM(R[-6]C:R[-1]C) -> -465046.590156533 | O65: =SUM(R[-6]C:R[-1]C) -> -5857711.2400613297
A67: CANADA WEST DELTA TOTAL | C67: =R[-2]C+R[-11]C -> 567203.15199024789 | D67: =R[-2]C+R[-11]C -> -940188.79692599794 | E67: =R[-2]C+R[-11]C -> -235873.05521257815 | F67: =R[-2]C+R[-11]C -> -1965720.042353462 | G67: =R[-2]C+R[-11]C -> -1033335.7405125884 | H67: =R[-2]C+R[-11]C -> -2480230.7130771796 | I67: =R[-2]C+R[-11]C -> -3363962.9566124966 | J67: =R[-2]C+R[-11]C -> -3752063.6851598741 | K67: =R[-2]C+R[-11]C -> -2814534.616419001 | L67: =R[-2]C+R[-11]C -> -3145973.2945950525 | M67: =R[-2]C+R[-11]C -> -2856292.8342889664 | N67: =R[-2]C+R[-11]C -> -2938304.5143943876 | O67: =R[-2]C+R[-11]C -> -24959277.097561337

Sheet: Lists
A1: "Revenue Type" | B1: "Service Type" | C1: "GM Unit" | D1: "Division Market" | E1: "Division" | F1: "Weighting %" | G1: "Industry" | H1: "Market" | I1: "Primary Service Offerings" | J1: "Product / Platform" | M1: 2014 | P1: 2015 | Y1: TO BE CONFIRMED - 2016
A2: Services | B2: Consulting Services | C2: Canada East | D2: Justice-Canada | E2: Canada East | F2: 0% | G2: Commercial | H2: Atlantic | I2: Application Management Services (AMS) | J2: Axios | M2: OCT | N2: NOV | O2: DEC | P2: JAN | Q2: FEB | R2: MAR | S2: APR | T2: MAY | U2: JUN | V2: JUL | W2: AUG | X2: SEP | Y2: OCT | Z2: NOV | AA2: DEC | AB2: JAN | AC2: FEB | AD2: MAR | AE2: APR | AF2: MAY | AG2: JUN | AH2: JUL | AI2: AUG | AJ2: SEP
A3: Product | B3: Managed Services | C3: Canada West | D3: Justice-US | E3: Canada West | F3: 10% | G3: Health | H3: Austin | I3: AMS Staff Augmentation | J3: Curam | M3: 22 | N3: 19 | O3: 21 | P3: 22 | Q3: 19 | R3: 21 | S3: 21 | T3: 19 | U3: 22 | V3: 21 | W3: 20 | X3: 22 | Y3: 22 | Z3: 20 | AA3: 21 | AB3: 21 | AC3: 19 | AD3: 22 | AE3: 21 | AF3: 20 | AG3: 22 | AH3: 22 | AI3: 20 | AJ3: 21
A4: M&S | B4: Other | C4: Canada West | D4: US (SLG/Com) | E4: Justice | F4: 30% | G4: Public Sector | H4: Calgary | I4: Business Intelligence (BI) | J4: EBS | L4: Calgary | M4: =R[-1]C*7.5 -> 165 | N4: =R[-1]C*7.5 -> 142.5 | O4: =R[-1]C*7.5 -> 157.5 | P4: =R[-1]C*7.5 -> 165 | Q4: =R[-1]C*7.5 -> 142.5 | R4: =R[-1]C*7.5 -> 157.5 | S4: =R[-1]C*7.5 -> 157.5 | T4: =R[-1]C*7.5 -> 142.5 | U4: =R[-1]C*7.5 -> 165 | V4: =R[-1]C*7.5 -> 157.5 | W4: =R[-1]C*7.5 -> 150 | X4: =R[-1]C*7.5 -> 165 | Y4: =R[-1]C*7.5 -> 165 | Z4: =R[-1]C*7.5 -> 150 | AA4: =R[-1]C*7.5 -> 157.5 | AB4: =R[-1]C*7.5 -> 157.5 | AC4: =R[-1]C*7.5 -> 142.5 | AD4: =R[-1]C*7.5 -> 165 | AE4: =R[-1]C*7.5 -> 157.5 | AF4: =R[-1]C*7.5 -> 150 | AG4: =R[-1]C*7.5 -> 165 | AH4: =R[-1]C*7.5 -> 165 | AI4: =R[-1]C*7.5 -> 150 | AJ4: =R[-1]C*7.5 -> 157.5
D5: Health-Canada East | E5: US | F5: 50% | G5: State & Local Govt. | H5: Edmonton | I5: Collaboration / ECM | J5: EMC | M5: 22 | N5: 19 | O5: 21 | P5: 22 | Q5: 19 | R5: 21 | S5: 21 | T5: 19 | U5: 22 | V5: 21 | W5: 20 | X5: 22 | Y5: 22 | Z5: 20 | AA5: 21 | AB5: 21 | AC5: 19 | AD5: 22 | AE5: 21 | AF5: 20 | AG5: 22 | AH5: 22 | AI5: 20 | AJ5: 21
D6: Health-Canada West | F6: 75% | H6: Health Alberta | I6: Custom Development (CD) | J6: Hansen | L6: Edmonton | M6: =R[-1]C*7.5 -> 165 | N6: =R[-1]C*7.5 -> 142.5 | O6: =R[-1]C*7.5 -> 157.5 | P6: =R[-1]C*7.5 -> 165 | Q6: =R[-1]C*7.5 -> 142.5 | R6: =R[-1]C*7.5 -> 157.5 | S6: =R[-1]C*7.5 -> 157.5 | T6: =R[-1]C*7.5 -> 142.5 | U6: =R[-1]C*7.5 -> 165 | V6: =R[-1]C*7.5 -> 157.5 | W6: =R[-1]C*7.5 -> 150 | X6: =R[-1]C*7.5 -> 165 | Y6: =R[-1]C*7.5 -> 165 | Z6: =R[-1]C*7.5 -> 150 | AA6: =R[-1]C*7.5 -> 157.5 | AB6: =R[-1]C*7.5 -> 157.5 | AC6: =R[-1]C*7.5 -> 142.5 | AD6: =R[-1]C*7.5 -> 165 | AE6: =R[-1]C*7.5 -> 157.5 | AF6: =R[-1]C*7.5 -> 150 | AG6: =R[-1]C*7.5 -> 165 | AH6: =R[-1]C*7.5 -> 165 | AI6: =R[-1]C*7.5 -> 150 | AJ6: =R[-1]C*7.5 -> 157.5
D7: Canada East | F7: 90% | H7: Los Angeles | I7: Enterprise Application (EA) | J7: IBM Platform | M7: 22 | N7: 19 | O7: 21 | P7: 22 | Q7: 19 | R7: 21 | S7: 21 | T7: 19 | U7: 22 | V7: 21 | W7: 20 | X7: 22 | Y7: 22 | Z7: 20 | AA7: 21 | AB7: 21 | AC7: 19 | AD7: 22 | AE7: 21 | AF7: 20 | AG7: 22 | AH7: 22 | AI7: 20 | AJ7: 21
D8: Canada West | F8: 100% | H8: Ottawa | I8: Identity Management Solutions (IMS) | J8: Manatron | L8: Regina | M8: =R[-1]C*7.5 -> 165 | N8: =R[-1]C*7.5 -> 142.5 | O8: =R[-1]C*7.5 -> 157.5 | P8: =R[-1]C*7.5 -> 165 | Q8: =R[-1]C*7.5 -> 142.5 | R8: =R[-1]C*7.5 -> 157.5 | S8: =R[-1]C*7.5 -> 157.5 | T8: =R[-1]C*7.5 -> 142.5 | U8: =R[-1]C*7.5 -> 165 | V8: =R[-1]C*7.5 -> 157.5 | W8: =R[-1]C*7.5 -> 150 | X8: =R[-1]C*7.5 -> 165 | Y8: =R[-1]C*7.5 -> 165 | Z8: =R[-1]C*7.5 -> 150 | AA8: =R[-1]C*7.5 -> 157.5 | AB8: =R[-1]C*7.5 -> 157.5 | AC8: =R[-1]C*7.5 -> 142.5 | AD8: =R[-1]C*7.5 -> 165 | AE8: =R[-1]C*7.5 -> 157.5 | AF8: =R[-1]C*7.5 -> 150 | AG8: =R[-1]C*7.5 -> 165 | AH8: =R[-1]C*7.5 -> 165 | AI8: =R[-1]C*7.5 -> 150 | AJ8: =R[-1]C*7.5 -> 157.5
H9: Regina | I9: ITSM Services | J9: Microsoft Dynamics | M9: 22 | N9: 19 | O9: 21 | P9: 22 | Q9: 19 | R9: 21 | S9: 21 | T9: 19 | U9: 22 | V9: 21 | W9: 20 | X9: 22 | Y9: 22 | Z9: 20 | AA9: 21 | AB9: 21 | AC9: 19 | AD9: 22 | AE9: 21 | AF9: 20 | AG9: 22 | AH9: 22 | AI9: 20 | AJ9: 21
H10: Toronto | I10: Management Consulting (MC) | J10: Microsoft Platform | L10: Vancouver | M10: =R[-1]C*7.5 -> 165 | N10: =R[-1]C*7.5 -> 142.5 | O10: =R[-1]C*7.5 -> 157.5 | P10: =R[-1]C*7.5 -> 165 | Q10: =R[-1]C*7.5 -> 142.5 | R10: =R[-1]C*7.5 -> 157.5 | S10: =R[-1]C*7.5 -> 157.5 | T10: =R[-1]C*7.5 -> 142.5 | U10: =R[-1]C*7.5 -> 165 | V10: =R[-1]C*7.5 -> 157.5 | W10: =R[-1]C*7.5 -> 150 | X10: =R[-1]C*7.5 -> 165 | Y10: =R[-1]C*7.5 -> 165 | Z10: =R[-1]C*7.5 -> 150 | AA10: =R[-1]C*7.5 -> 157.5 | AB10: =R[-1]C*7.5 -> 157.5 | AC10: =R[-1]C*7.5 -> 142.5 | AD10: =R[-1]C*7.5 -> 165 | AE10: =R[-1]C*7.5 -> 157.5 | AF10: =R[-1]C*7.5 -> 150 | AG10: =R[-1]C*7.5 -> 165 | AH10: =R[-1]C*7.5 -> 165 | AI10: =R[-1]C*7.5 -> 150 | AJ10: =R[-1]C*7.5 -> 157.5
H11: Vancouver | I11: Privacy / Security | J11: Microsoft SharePoint | M11: 22 | N11: 19 | O11: 21 | P11: 22 | Q11: 19 | R11: 21 | S11: 21 | T11: 19 | U11: 22 | V11: 21 | W11: 20 | X11: 22 | Y11: 22 | Z11: 20 | AA11: 21 | AB11: 21 | AC11: 19 | AD11: 22 | AE11: 21 | AF11: 20 | AG11: 22 | AH11: 22 | AI11: 20 | AJ11: 21
H12: Victoria | I12: SI (Staff Augmentation) | J12: OnBase | L12: Victoria | M12: =R[-1]C*7.5 -> 165 | N12: =R[-1]C*7.5 -> 142.5 | O12: =R[-1]C*7.5 -> 157.5 | P12: =R[-1]C*7.5 -> 165 | Q12: =R[-1]C*7.5 -> 142.5 | R12: =R[-1]C*7.5 -> 157.5 | S12: =R[-1]C*7.5 -> 157.5 | T12: =R[-1]C*7.5 -> 142.5 | U12: =R[-1]C*7.5 -> 165 | V12: =R[-1]C*7.5 -> 157.5 | W12: =R[-1]C*7.5 -> 150 | X12: =R[-1]C*7.5 -> 165 | Y12: =R[-1]C*7.5 -> 165 | Z12: =R[-1]C*7.5 -> 150 | AA12: =R[-1]C*7.5 -> 157.5 | AB12: =R[-1]C*7.5 -> 157.5 | AC12: =R[-1]C*7.5 -> 142.5 | AD12: =R[-1]C*7.5 -> 165 | AE12: =R[-1]C*7.5 -> 157.5 | AF12: =R[-1]C*7.5 -> 150 | AG12: =R[-1]C*7.5 -> 165 | AH12: =R[-1]C*7.5 -> 165 | AI12: =R[-1]C*7.5 -> 150 | AJ12: =R[-1]C*7.5 -> 157.5
A13: ClientStatus | H13: WA State | I13: SI Solutions (Project) | J13: Oracle Platform | M13: 22 | N13: 19 | O13: 21 | P13: 22 | Q13: 19 | R13: 21 | S13: 21 | T13: 19 | U13: 22 | V13: 21 | W13: 20 | X13: 22 | Y13: 22 | Z13: 20 | AA13: 21 | AB13: 21 | AC13: 19 | AD13: 22 | AE13: 21 | AF13: 20 | AG13: 22 | AH13: 22 | AI13: 20 | AJ13: 21
A14: Existing | H14: Winnipeg | I14: HLTH-Business Systems (BUS) | J14: PeopleSoft | L14: Winnipeg | M14: =R[-1]C*7.5 -> 165 | N14: =R[-1]C*7.5 -> 142.5 | O14: =R[-1]C*7.5 -> 157.5 | P14: =R[-1]C*7.5 -> 165 | Q14: =R[-1]C*7.5 -> 142.5 | R14: =R[-1]C*7.5 -> 157.5 | S14: =R[-1]C*7.5 -> 157.5 | T14: =R[-1]C*7.5 -> 142.5 | U14: =R[-1]C*7.5 -> 165 | V14: =R[-1]C*7.5 -> 157.5 | W14: =R[-1]C*7.5 -> 150 | X14: =R[-1]C*7.5 -> 165 | Y14: =R[-1]C*7.5 -> 165 | Z14: =R[-1]C*7.5 -> 150 | AA14: =R[-1]C*7.5 -> 157.5 | AB14: =R[-1]C*7.5 -> 157.5 | AC14: =R[-1]C*7.5 -> 142.5 | AD14: =R[-1]C*7.5 -> 165 | AE14: =R[-1]C*7.5 -> 157.5 | AF14: =R[-1]C*7.5 -> 150 | AG14: =R[-1]C*7.5 -> 165 | AH14: =R[-1]C*7.5 -> 165 | AI14: =R[-1]C*7.5 -> 150 | AJ14: =R[-1]C*7.5 -> 157.5
A15: New | I15: HLTH-Clinical Information Systems (CIS) | J15: SOA
I16: HLTH-Electronic Health Records (EHR) | J16: Software AG
I17: HLTH-Electronic Medical Records (EMR) | J17: SunGuard/Banner
I18: HLTH-Patient Access to Quality Care (PAQC) | J18: Workday
I19: HLTH-Public Health & Surveillance (PUB) | J19: Other
A20: Canada East | B20: Canada West | C20: Sierra US | E20: IndustryUS | F20: IndustryCanada | I20: HLTH-Registries (REG)
A21: Atlantic | B21: Calgary | C21: Northeast | E21: Commercial | F21: Commercial | I21: HLTH-Other
A22: Ottawa | B22: Edmonton | C22: Southeast | E22: Justice | F22: Health
A23: Toronto | B23: Regina | C23: Midwest | E23: Public Sector | F23: Justice
B24: Vancouver | C24: TOLA | F24: Public Sector
B25: Victoria | C25: Northwest | F25: Energy & Utilities
B26: Winnipeg | C26: West
A29: Specialized Solution | E29: ProductUS | F29: ProductCanada | H29: Primary Service OfferingsUS | I29: Primary Service OfferingsCanada
A30: Align | E30: Business Intelligence (BI) | F30: Business Intelligence (BI) | H30: Business Intelligence (BI) | I30: Business Intelligence (BI)
A31: Axios | E31: e-Business Suite (EBS) | F31: Custom Development (CD) | H31: Custom Development (CD) | I31: Collaboration / ECM
A32: Curam | E32: Infor | F32: e-Business Suite (EBS) | H32: Enterprise Application (EA) | I32: Custom Development (CD)
A33: Engage | E33: PeopleSoft (PS) | F33: Fusion (FSN) | H33: AMS (Other) | I33: Enterprise Application (EA)
A34: HLTH-Business Systems (BUS) | E34: Other | F34: Infor | H34: SI (Other) | I34: Management Consulting (MC)
A35: HLTH-Chronic Disease Management (CDM) | F35: Mgmt Consulting (MC) | I35: AMS (Other)
A36: HLTH-Clinical Information Systems (CIS) | F36: MS Dynamics | I36: SI (Other)
A37: HLTH-Consumer Health | F37: MS SharePoint
A38: HLTH-Electronic Health Records (EHR) | F38: PeopleSoft (PS)
A39: HLTH-Other | F39: Other
A40: HLTH-Primary Care
A41: HLTH-Public Health & Surveillance (PUB)
A42: HLTH-Registries (REG)
A43: Identity Management Solutions
A44: ITSM
A45: JPS - Law Enforcement & Public Safety
A46: JPS - Courts and Legal
A47: JPS - Corrections
A48: JPS - Integrated Justice
A49: JPS - Other
A50: Lead
A51: Manatron
A52: Microsoft Platform
A53: Oracle Platform
A54: Open Text / Livelink
A55: Other
A56: Perform
A57: Softcode
A58: Software AG
A59: Tyler

Sheet: Top Accounts by Location
A1: Revenue Type | B1: Services | D1: Revenue Type | E1: Services
A2: Service Type | B2: (All) | D2: Service Type | E2: (All)
A3: Probability Weights | B3: (All) | D3: Probability Weights | E3: (All)
A5: Row Labels | B5: Sum of Total FY15 WT | D5: Row Labels | E5: Sum of Total FY15 WT
A6: Calgary | B6: 19526813.012633 | D6: Calgary | E6: 19526813.012633
A7: Frandsen, Cory | B7: 7353802.8376329998 | D7: Frandsen, Cory | E7: 7353802.8376329998
A8: Altalink Management Ltd | B8: 1620042.74 | D8: Altalink Management Ltd | E8: 1620042.74
A9: Astra Energy Canada Inc. | B9: 162500 | D9: Astra Energy Canada Inc. | E9: 162500
A10: Astra Oil Company LLC | B10: 50090.932633000004 | D10: Astra Oil Company LLC | E10: 50090.932633000004
A11: Cenovus Energy Inc | B11: 218535 | D11: Cenovus Energy Inc | E11: 218535
A12: City of Calgary | B12: 237760 | D12: City of Calgary | E12: 237760
A13: Ensign Energy Services | B13: 135050 | D13: Ensign Energy Services | E13: 135050
A14: Plains Midstream Canada ULC | B14: 998467 | D14: Plains Midstream Canada ULC | E14: 998467
A15: HP Co Canada- Cenovus | B15: 589018.83499999996 | D15: HP Co Canada- Cenovus | E15: 589018.83499999996
A16: Connacher Oil and Gas Limited | B16: 7955 | D16: Connacher Oil and Gas Limited | E16: 7955
A17: Packers Plus Energy Services | B17: 271540 | D17: Packers Plus Energy Services | E17: 271540
A18: Tervita (formerly CCS ) Corporation | B18: 500000 | D18: Tervita (formerly CCS ) Corporation | E18: 500000
A19: Encana Services Company Ltd. | B19: 750171.5 | D19: Encana Services Company Ltd. | E19: 750171.5
A20: Real Estate Council of Alberta (RECA) | B20: 651044.33000000007 | D20: Real Estate Council of Alberta (RECA) | E20: 651044.33000000007
A21: Real Estate Council of Alberta (RECA | B21: 75000 | D21: Real Estate Council of Alberta (RECA | E21: 75000
A22: Nexen | B22: 97460 | D22: Nexen | E22: 97460
A23: Nexen | B23: 60000 | D23: Nexen | E23: 60000
A24: Pason Systems Inc. | B24: 21000 | D24: Pason Systems Inc. | E24: 21000
A25: Pure Technologies | B25: 417067.5 | D25: Pure Technologies | E25: 417067.5
A26: Bellatrix | B26: 41100 | D26: Bellatrix | E26: 41100
A27: Mawer Investment Banking | B27: 300000 | D27: Mawer Investment Banking | E27: 300000
A28: APMC | B28: 150000 | D28: APMC | E28: 150000
A29: Hulme, Dennis | B29: 173976.07 | D29: Hulme, Dennis | E29: 173976.07
A30: Alberta Health Services | B30: 173976.07 | D30: Alberta Health Services | E30: 173976.07
A31: Johnson, Sarah | B31: 4140896.5 | D31: Johnson, Sarah | E31: 4140896.5
A32: Alberta Health Services | B32: 4140896.5 | D32: Alberta Health Services | E32: 4140896.5
A33: Milloy, Brian | B33: 5974209.9699999997 | D33: Milloy, Brian | E33: 5974209.9699999997
A34: Calgary Airport Authority | B34: 1858230.74 | D34: Calgary Airport Authority | E34: 1858230.74
A35: Calgary Immigrant Womens Assoc | B35: 6600 | D35: Calgary Immigrant Womens Assoc | E35: 6600
A36: Canadian Pacific Railway | B36: 197196.47999999998 | D36: Canadian Pacific Railway | E36: 197196.47999999998
A37: CEDA International Corporation | B37: 170220 | D37: CEDA International Corporation | E37: 170220
A38: Shaw Communications Inc. | B38: 3307419.25 | D38: Shaw Communications Inc. | E38: 3307419.25
A39: Sound Dymax Inc. | B39: 167206.25 | D39: Sound Dymax Inc. | E39: 167206.25
A40: Strike Energy Services Inc. | B40: -3662.75 | D40: Strike Energy Services Inc. | E40: -3662.75
A41: University of Calgary | B41: 0 | D41: University of Calgary | E41: 0
A42: Osum Oil Sands Corp | B42: 245000 | D42: Osum Oil Sands Corp | E42: 245000
A43: Alliance Pipelines | B43: 26000 | D43: Alliance Pipelines | E43: 26000
A44: Semeniuk, Darcy | B44: 1763927.6350000002 | D44: Semeniuk, Darcy | E44: 1763927.6350000002
A45: Cenovus Energy Inc | B45: 30000 | D45: Cenovus Energy Inc | E45: 30000
A46: HP Co Canada- Cenovus | B46: 1733927.6350000002 | D46: HP Co Canada- Cenovus | E46: 1733927.6350000002
A47: Van Dorp, Abe | B47: 120000 | D47: Van Dorp, Abe | E47: 120000
A48: Calgary Police Service | B48: 120000 | D48: Calgary Police Service | E48: 120000
A49: Edmonton | B49: 8769327.3873056676 | D49: Grand Total | E49: 19526813.012633
A50: Coward, Craig | B50: 2591559.7799999998
A51: HP Co Canada | B51: 949353.9
A52: Alberta Culture and Tourism | B52: 1642205.88
A53: Groshong, Willis | B53: 2063263
A54: Alberta Municipal Affairs | B54: 227055.25
A55: Christmas Bureau of Edmonton | B55: 2347
A56: Canadian Western Bank | B56: 252580
A57: Alberta Innovates - Technology Futures | B57: 24000
A58: Northgate Information Solutions Canada | B58: 1274595.75
A59: 630 CHED Santas Anonymous | B59: 4485
A60: City of Spruce Grove | B60: 25500
A61: ASHC Housing Corp | B61: 182700
A62: Strathcona County | B62: 25000
A63: Alberta Energy | B63: 45000
A64: Hulme, Dennis | B64: 695442.5
A65: NWT Dept of Health and Social Services | B65: 695442.5
A66: Kraus, Carey | B66: 1030292.97
A67: City of Edmonton | B67: 443745
A68: WCB Alberta | B68: 587717
A69: Wipro Solutions Canada (formerly ATCO I-Tek) | B69: -1169.03
A70: Van Dorp, Abe | B70: 2388769.1373056686
A71: Alberta Solicitor General | B71: 1573730.9523056685
A72: Alberta Justice & Solicitor General | B72: 815038.18500000006
A73: Regina | B73: 1906890.2625
A74: Kostelnyk, Janice | B74: 494568
A75: Government of Saskatchewan | B75: 134657.5
A76: Sask Workers' Compensation Board | B76: 235682.5
A77: Saskatchewan Info and Tech Office | B77: 121228
A78: City of Regina | B78: 3000
A79: Thomson, Dan | B79: 965777.46250000002
A80: Saskatchewan Justice | B80: 965777.46250000002
A81: Wildman, Tim | B81: 446544.8
A82: eHealth Saskatchewan | B82: 446544.8
A83: Vancouver | B83: 19050926.759999998
A84: Collins, Carol | B84: 10002653.529999999
A85: Alpac Forest Products Inc | B85: 160000
A86: Interfor | B86: 216691
A87: Kal Tire | B87: 1008741.4500000001
A88: NGRAIN Corporation | B88: 1050
A89: Pacific Blue Cross | B89: 1735377
A90: Stella-Jones Canada Inc | B90: 15720
A91: Tembec Industries Inc | B91: 6210
A92: TimberWest Forest Corp. | B92: 90850
A93: Tolko Industries Ltd | B93: 2118406.5
A94: Vancouver International Airport Auth. | B94: 122540
A95: Goldcorp Inc | B95: 4103274.81
A96: Bell Lumber & Pole | B96: 177305
A97: ITC Construction Group | B97: 150637.5
A98: Forest City Trading Group | B98: 15000
A99: Springer Creek Forest Products Ltd. | B99: 1440
A100: Ainsworth Engineered | B100: 79410.27
A101: Fabi, Roger | B101: 1134172.5
A102: BC Automobile Association | B102: 233252.5
A103: Canadian Western Trust | B103: 362220
A104: Mountain Equipment Co-op | B104: 538700
A105: Hayden, Carolyn | B105: 3843686.19
A106: Annex Consulting Group Inc. | B106: 102004.79999999999
A107: Prov Health Services Authority | B107: 63560
A108: WorkSafeBC | B108: 595949
A109: Industry Trade Authority | B109: 2400
A110: Imperial Parking | B110: 407400
A111: Telus Sourcing Solutions | B111: 2066909.5999999999
A112: College Registered Nurses British Colum | B112: 460152.79000000004
A113: Health Authority | B113: 16800
A114: Vancouver Coastal Health | B114: 9000
A115: Yukon Territorial Government | B115: 21000
A116: Providence Health Care LMC HIM | B116: 4000
A117: College of Registered Nurses BC | B117: 6000
A118: British Columbia Hydro | B118: 21760
A119: TELUS - Pacific Autism Family Centre | B119: 48000
A120: First Nations Health Authority | B120: 18750
A121: Hughes, Bev | B121: 597688.36
A122: College of Physicians and Surgeons BC | B122: 578488.36
A123: Kool-IP | B123: 19200
A124: McNeil, Graeme | B124: 753522.5
A125: Insurance Corp of British Columbia(ICBC) | B125: 665185
A126: Aeroinfo Systems a Div of Boeing Canada | B126: 88337.5
A127: Thomson, Dan | B127: 67500
A128: Royal Canadian Mounted Police - E Divisi | B128: 67500
A129: Hunter, Rick | B129: 2651703.6800000002
A130: Seaspan Ship Management Ltd | B130: 7102.5
A131: University of British Columbia | B131: 1127040.17
A132: Vancouver Board of Education | B132: 176202.43
A133: MITACS Inc | B133: 463743.58
A134: City Surrey Richmond | B134: 150000
A135: Credit Unions Vancity Blueshore | B135: 0
A136: Simon Fraser University | B136: 252419.69
A137: Metro Vancouver | B137: 50000
A138: British Columbia Liquor Distribution Branch (BCLDB) | B138: 425195.31
A139: Victoria | B139: 21080470.700000003
A140: Brisbane, Ross | B140: 3626407.4400000004
A141: British Columbia Pension Corp | B141: 657335.32000000007
A142: HP Co Canada | B142: 6000
A143: JEA PENSIONS | B143: 581195
A144: HP ADVANCED SOLUTIONS INC | B144: 2026889.62
A145: British Columbia Oil and Gas Commission | B145: 354987.5
A146: Fabi, Roger | B146: 4688215.62
A147: BC Ministry of Children and Family Dev | B147: 153360
A148: British Columbia Ministry of Health | B148: 670188.13
A149: Harmac Pacific | B149: 35007.040000000001
A150: BC Ministry of Tech, Innov, & Citz Serv | B150: 3804507.45
A151: Unit4 Business Software Corporation | B151: 25153
A152: Hayden, Carolyn | B152: 12945
A153: Telus Communications Company | B153: 12945
A154: McNeil, Graeme | B154: 6594450.5200000005
A155: British Columbia Assessment | B155: 250187.5
A156: British Columbia Ferry Services Inc | B156: 1364319.3900000001
A157: Medplus Inc | B157: 484834.83
A158: BC Ministry of Tech, Innov, & Citz Serv | B158: 863649.72
A159: Telus Sourcing Solutions | B159: 3553859.08
A160: Leading Matters Consulting Inc | B160: 0
A161: BC Ministry Transport & Infrastructure | B161: 77600
A162: Robinson, Charlie | B162: 6158452.1200000001
A163: BC Ministry of Justice | B163: 6104000.1200000001
A164: International Technology Integration Inc | B164: 29812
A165: E-COMM Emergency Comm for SW BC Inc. | B165: 2140
A166: Justice Institute of British Columbia | B166: 22500
A167: Winnipeg | B167: 10254162.040000001
A168: Kostelnyk, Janice | B168: 5828429.1899999995
A169: Great-West Life Assurance Co | B169: 867153.65
A170: Investors Group | B170: 2349742.04
A171: MTS Allstream Inc | B171: 1531262.5
A172: Wawanesa Mutual Insurance | B172: 747616.5
A173: Princess Auto | B173: 332654.5
A174: Wildman, Tim | B174: 4425732.8499999996
A175: City of Winnipeg | B175: 30000
A176: Diagnostic Services of Manitoba | B176: 392499.51
A177: Manitoba Housing and Renewal Corp | B177: 385188
A178: MB Justice | B178: 60000
A179: University of Manitoba | B179: 456556.24
A180: Winnipeg Reg Health Authority | B180: 2664579.64
A181: Workers Comp Board of Manitoba | B181: 202293.21
A182: Manitoba Family Services and Labour | B182: 130168.75
A183: Manitoba Jobs and the Economy | B183: 22500
A184: RedMane Technology | B184: 81947.5
A185: Grand Total | B185: 80588590.162438676